article_name,journalist,publisher,date,article
90년 묵은 ‘상호관세’ 꺼낸 트럼프…‘관세 98% 폐지’ 한국은 안심?,"남지현,",한겨례,2025-02-10,"‘트럼프발’ 관세 전쟁 양상이 한층 복잡해지고 있다. 미국 트럼프 정부는 지난달 20일 출범 직후 캐나다·멕시코·중국을 겨냥한 추가(additional) 관세 부과 방침을 내놓으며 전세계 무역 질서에 일대 파란을 일으킨 데 이어 이번에는 ‘상호주의에 따른 관세’(Reciprocal Tariff) 카드를 꺼내 들었다. 상대국이 미국에 부과한 관세만큼 미국도 해당국에 같은 수준으로 관세를 매긴다는 취지로 읽힌다. 도널드 트럼프 대통령은 지난 7일(현지시각) 이시바 시게루 일본 총리와 회담 뒤 한 공동 기자회견에서 “상호 관세를 부과할 것이며 아마도 10일 또는 11일에 관련 회의를 가진 뒤 발표할 것”이라고 말했다. 이어 “상호 관세 방식은 특정 국가가 우리에게 특정 금액을 부과하면, 우리도 동일한 방식으로 부과하는 것이다. 가장 공정한 방식”이라며 “이는 고정된 요율 관세보다 더 합리적”이라고 그는 덧붙였다. ‘상호주의에 따른 관세법’(RTAA)은 보호무역이 기승을 부리던 1934년에 등장한 바 있다. 관세 장벽을 쌓는 입법(스무트-홀리법, 1930)의 부작용이 커지면서 민주당이 내놨다. 무역 상대국이 관세율을 낮출 경우 상호주의에 따라 상대국에 대한 관세를 낮출 수 있는 권한을 미 대통령에게 부여하는 게 뼈대다. 1960년대 말까지 생명을 이어갔다. 트럼프의 구상은 상호주의를 내세운 점에선 같지만 그 방향은 과거와는 정반대인 셈이다. 미 정부의 관세 전략은 무역적자를 줄이려는 포석과 함께 대규모 감세 정책에 따라 부족한 세수를 관세 수입으로 메우려는 구상이 깔려 있다. 관세 정책의 강도와 속도가 재정 정책과 함께 맞물려 돌아간다는 뜻이다. 이런 점에서 조만간 미 정부가 내놓을 감세 및 예산안 패키지 법안과 해당 법안의 통과 여부를 주목해야 한다. 공화당은 상·하원에서 근소한 차이로 다수당 지위를 유지하고 있다. 미 정부의 이런 계획이 우리나라에 미칠 영향은 현재로선 가늠하기 어렵다. 일단 우리나라와 미국은 자유무역협정이 체결돼 있다. 관세 장벽이 사실상 없다는 점에서 한국은 트럼프의 상호 관세 구상에서 비켜 있을 공산이 높다는 뜻이다. 2022년 3월 대외경제정책연구원이 내놓은 분석을 보면, 두 나라 간 무역에서 품목의 약 98%에 관세가 전면 폐지됐다. 하지만 트럼프의 ‘상호 관세’의 구체 내용에 따라 전혀 다른 사태가 전개될 가능성을 배제하긴 어렵다. 한 예로 관세 부과 기준을 ‘무역 적자액’으로 삼는다면 우리는 막대한 관세를 물어야 한다. 전문가들은 상호 관세보다는 미 정부가 검토 중인 무역협정 변경과 보편 관세 도입 여부에 더 주목해야 한다고 본다. 미 정부는 해당 사안에 대해 오는 4월 초까지 검토를 마무리한 뒤 전반적인 관세 정책을 확정한다고 밝힌 바 있다. 9일 한국무역협회가 발표한 보고서 ‘트럼프 2기 행정부 관세조치에 따른 영향 분석’을 보면, 보편 관세가 현실화될 경우 우리나라 총수출은 지난해(1~11월) 수출금액 기준 1.9% 감소하며, 중국·캐나다·멕시코에만 추가 관세가 부과되면 총수출 감소 폭이 0.1%를 크게 밑돈다. 양지원 무역협회 수석연구원은 “보편 관세 부과 여부가 한국의 수출에 변곡점이 될 전망”이라고 말했다. 워싱턴/김원철 특파원 wonchul@hani.co.kr"
다양·평등·포용 지우는 빅테크…‘테슬라 인종차별’에 머스크는 몸사려,선담은,한겨례,2025-02-09,"구글·아마존·메타 등 빅테크 기업들이 도널드 트럼프 행정부 기조에 맞춰 소수인종 채용 등을 장려한 ‘다양성·형평성·포용성(DEI) 정책’을 잇달아 폐기·축소하고 있다. 반면 정작 이 정부의 ‘실세’ 일론 머스크의 회사는 주주들의 비판을 의식해 인종차별 논란에 몸을 사리는 모양새다. 아마존이 지난 7일(현지시각) 미 증권거래위원회(SEC)에 제출한 2024년 연례보고서를 보면, 전년도까지 회사의 인사 정책 방향으로 언급했던 ‘포용과 다양성’(inclusion and diversity)이란 문구가 사라졌다. 앞서 이 회사는 도널드 트럼프 공화당 대통령 후보의 당선 후인 지난해 12월 디이아이 정책에 대한 입장 변화를 예고한 바 있다. 구글과 메타도 비슷한 행보를 보이고 있다. 구글은 지난 2020년 백인 경찰의 과잉 진압으로 사망한 흑인 조지 플로이드 사건을 계기로 대규모 시위가 벌어지자 2025년까지 회사 고위직 가운데 비백인 및 여성 등 소수자 비중을 30%까지 확대한다는 목표를 세웠으나 최근 이 계획을 철회했다. 또 2014년부터 발간한 ‘연례 다양성 보고서’도 계속 낼지 여부를 검토 중이라고 월스트리트저널(WSJ)은 전했다. 페이스북 모회사 메타도 지난달 회사 내 디이아이 정책 부서를 없애고 관련 프로그램을 종료하기로 했다. 자넬 게일 메타 인사 담당 부사장은 사내 공지에서 “미국의 다양성·형평성·포용성 노력을 둘러싼 법적 및 정책적 환경이 변화하고 있다”고 설명했다. 반면 디이아이 정책 공격에 앞장섰던 일론 머스크 최고경영자(CEO)의 회사 테슬라는 수년간 이어진 행동주의 투자자들의 비판을 잠재우기 위해 ‘직장 내 평등’을 노력하는 듯한 움직임을 보이고 있다. 테슬라는 지난달 29일 낸 연례보고서에서 향후 “회사가 어떻게 우수한 인재를 모집해 이들을 육성하는지”를 사내 보상위원회가 모니터링하고 “적절한 경우 회사 정책 및 관행을 개정할 것을 권고한다”고 명시했다. 이런 원론적인 입장에 대해 뉴욕타임스(NYT)는 캘리포니아주 프리몬트 공장의 인종차별 문제를 오랫동안 비판한 주주들의 압력에 의한 것이라고 풀이했다. 테슬라는 2015∼2016년 이 공장에서 일했던 흑인 노동자가 회사를 상대로 낸 손해배상 청구 소송에서 사업장 내 인종차별을 방치한 사실이 인정돼 논란에 휩싸였다. 소송은 지난해 3월 양쪽 간 합의로 종결됐지만, 행동주의 펀드 니아 임팩트 캐피탈 등은 테슬라 이사회가 ‘포용적 인사 정책’을 펼쳐야 한다는 내용의 주주 결의안을 테슬라에 낸 바 있다. 니아 임팩트 캐피탈 설립자인 크리스틴 헐은 디이아이 정책을 공격해온 머스크 회사의 움직임에 대해 “모순적”이라고 이 매체에 인터뷰했다."
IMF “한국 경제 하방 위험”…정책기조 변경해 추경 편성 권고,"최하얀,",한겨례,2025-02-09,"국제통화기금(IMF)이 한국 정부에 추가 재정지출을 권고했다. 미국이 주도하는 보호무역주의 심화와 12·3 내란 사태가 촉발한 정치적 불확실성 확대가 경제 성장을 제약하는 요소로 작용하는 만큼 추가 재정지출 등 정책 기조의 변화가 요구된다는 것이다. 사실상 조속한 추가경정예산 편성을 권고한 것으로 해석된다. 나아가 아이엠에프는 상속세 완화와 금융투자소득세 폐지 등에 대해 우려의 목소리를 냈다. 9일 아이엠에프가 최근 공개한 ‘2024년 한국 연례협의 보고서’를 보면, 이 기구는 한국의 올해 경제 성장률을 2.0%로 전망하면서도, “한국 경제의 불확실성이 커졌고 하방 위험이 우세하다”는 점을 여러 차례 강조했다. 국제통화기금 협의단이 내란 사태 이전인 지난해 11월 한국을 방문해 경제 현황을 점검한 만큼, 내란 사태 충격으로 인한 성장률 전망값 하향은 보류하되 불확실성에 대한 경고장을 던진 것으로 보인다. 실제 아이엠에프는 오는 4월 발표 예정인 ‘세계경제전망’을 통해 한국 성장률 전망치를 대폭 하향 조정할 거란 관측도 나온다. 앞서 내란 충격으로 인한 민간 소비 둔화 등을 확인한 기획재정부와 한국은행은 각각 1.8%, 1.6~1.7%의 경제 성장률 전망값을 제시한 바 있다. 아이엠에프는 통화·재정정책 조정 필요성을 시나리오별로 구분해 적시했다. 내수가 회복되지 않거나 글로벌 반도체 수요 약세로 경제성장이 예상보다 더 둔화하는 시나리오에선 기준금리를 더 빠르게 인하하거나 한시적인 추가 재정 지원이 이뤄져야 한다고 아이엠에프는 권고했다. 중동 갈등 고조로 유가가 급등하고 글로벌 공급 충격이 나타나는 시나리오에선 재정을 확대하되 기준금리 인하는 권고에서 뺐다. 물가 상승 위험을 염두에 뒀기 때문이다. 보고서는 “한국의 상당한 단기 재정 여력(fiscal space)을 고려할 때, 취약계층 지원과 고용 인센티브, 가계 구매력 강화를 위한 한시적 보조금 확대를 지원할 수 있다”며 추가 재정 지출 사업까지 콕 짚기도 했다. 관세전쟁이 본격화하는 세번째 시나리오에서는 통화정책과 재정정책이 모두 ‘완화적’이어야 한다고 이 기구는 제안했다. 금리도 내리고 재정도 확대해야 한다는 뜻이다. 다만 아이엠에프는 “추가 재정 지원을 하더라도 장기적인 지속 가능성도 고려해야 한다”고 강조했다. 이는 급격한 고령화로 재정정책의 기반이 허물어질 위험이 커지고 있기 때문이다. 아이엠에프는 그 방안으로 “연금 개혁, 재정준칙 채택, 재정수입 동원역량 강화, 지출 증가 합리화” 등을 제시했다. 그간 윤석열 정부가 ‘건전재정’ 기조를 강조하며 지출 억제에만 매달린 것과 달리, 아이엠에프는 세입기반 강화도 꼭 필요한 재정 개혁 과제로 제시한 셈이다. 이런 맥락에서 아이엠에프는 상속세 완화와 금융투자소득세 폐지 등 ‘감세를 통한 밸류업’ 시도에 회의적인 시각도 드러냈다. 보고서는 “세제 인센티브가 주주 수익률에 끼치는 장기적 영향은 불분명하다”며 “세제 인센티브의 잠재적 이익(주주 수익 증대)과 비용(재정의 지속 가능성과 조세 형평성)을 고려해 신중한 검토가 필요하다”고 밝혔다."
"정부, 하반기부터 전세대출 한도 축소…DSR 대신 보증한도 줄이기로",박수지,한겨례,2025-02-09,"정부가 세입자 소득 등을 따져 보증한도를 줄여 전세대출을 조인다. 관대한 전세대출이 전셋값과 집값을 끌어올린다는 지적 때문인데, 전세대출에 총부채원리금상환비율(DSR) 등 규제 방안을 직접 적용하지 않으면서도 이와 비슷한 효과를 낼 전망이다. 국토교통부는 올해 1분기 중 세입자가 전세대출을 못 갚을 때 보증기관이 대신 갚아주는 비율을 축소하고, 하반기부터 세입자 소득, 기존 대출 등 상환능력을 반영해 주택도시보증공사(HUG·허그) 전세대출 보증 한도를 정하기로 했다고 9일 밝혔다. 세입자는 허그, 주택금융공사(HF), 서울보증보험 중 한 곳에서 보증을 받아 전세대출을 받는다. 현재 은행은 세입자가 대출금을 갚지 못하면, 보증기관이 이를 대신 갚아주겠다는 보증서를 믿고 담보가 없어도 전세대출을 해준다. 지금까지 허그는 세입자의 소득을 고려하지 않고 임대보증금의 80% 이내에서 수도권 4억원, 지방 3억2천만원까지 대출금의 100%를 보증한다. 예를 들어 3억원짜리 전셋집을 구할 때 소득과 관계없이 2억4천만원까지 전세대출을 받을 수 있고 세입자가 못 갚으면 전부 허그가 갚아준다. 정부는 1분기 중 현재 100%인 허그와 서울보증의 전세대출 보증 비율을 주택금융공사 수준인 90%까지 낮추기로 했다. 2억4천만원을 빌린 세입자가 대출금을 못 갚으면 2억1600만원만 갚아준다는 뜻이다. 이렇게 되면 은행들은 대출 심사를 더 깐깐하게 하고, 금리를 높일 가능성이 있다. 아울러 하반기부터는 허그 전세대출 보증도 주택금융공사처럼 소득과 기존 대출을 고려해 보증 한도를 조정할 방침이다. 소득이 낮거나, 기존 대출이 많으면 전세대출 한도 자체가 줄어들 수 있다는 뜻이다. 양대 보증기관의 지난해 전세대출 보증 규모는 주택보증공사 52조5천914억원, 허그 32조9397억원으로 모두 85조5311억원에 달한다. 국토부 관계자는 “상환 능력을 넘어 무리하게 한도까지 대출받는 것을 방지하려는 취지”라며 “충분한 유예기간을 두고 시행하겠다”고 말했다. 국토연구원은 최근 발간한 보고서에서 전세대출 관련 보증 공급 규모가 3.8% 증가할 때 전셋값은 연간 8.21% 오른다고 분석했다."
"셋톱박스 제조사에 ‘갑질 의혹’ 브로드컴, 자진시정 절차 개시",안태호,한겨례,2025-02-09,"국내 유료방송 셋톱박스 제조사를 상대로 자사 제품 사용을 강요한 혐의로 공정거래위원회 조사를 받는 다국적 시스템반도체 기업 ‘브로드컴’이 자진 시정방안을 마련하기로 했다. 공정위는 9일 브로드컴이 신청한 동의의결 내용을 심의해 절차를 개시하기로 결정했다고 밝혔다. 동의의결은 공정위 조사를 받는 사업자가 스스로 원상회복, 피해구제 등 타당한 시정방안을 제안하면 위법 여부를 확정하지 않고 사건을 신속히 종결하는 제도다. 공정위는 현재 공정거래법상 금지된 ‘배타조건부거래’ 위반 혐의로 브로드컴을 조사하고 있다. 배타조건부거래는 시장 지배적 사업자가 거래 상대방에게 다른 경쟁 업체와 거래하지 말라고 요구하는 행위를 말한다. 브로드컴은 국내 셋톱박스 반도체 시장의 70∼80%를 차지하는 시장 지배적 사업자다. 국내 셋톱박스 시장에서는 유료방송 사업자가 입찰 공고를 내면, 제조사들이 제안서를 제출하는 방식으로 거래가 이뤄진다. 그런데 브로드컴은 제조사가 입찰에 참여할 때 자사 제품이 쓰인 셋톱박스만 제안하도록 강요한 것으로 조사됐다. 또 이미 경쟁사의 반도체를 사용하기로 한 제조사에도 자사 제품으로 변경하라고 요구했다. 공정위는 제조사들이 브로드컴의 요구를 거절하기 어렵다고 판단했다. 셋톱박스 반도체 물량의 대부분을 공급하는 브로드컴이 판매나 배송을 중단하거나 지연시키면, 대체품을 빠르게 구하기 어려운 제조사들은 꼼짝없이 사업상 어려움을 겪을 수밖에 없기 때문이다. 이 사건은 아직 심사보고서(검찰의 공소장과 유사)를 발송하기 전 단계지만, 브로드컴이 자발적으로 상생·협력을 도모하겠다며 공정위에 동의의결 절차 개시를 신청한 것이다. 먼저 브로드컴은 자사 제품을 탑재하라는 강요를 멈추고, 기존 거래 조건도 제조사에 불리하게 바꾸지 않기로 했다. 130억원 규모의 상생기금을 조성해 반도체 인력센터를 설립·운영하고, 반도체 스타트업에 컨설팅 및 인프라 구축을 지원하기로 했다. 공정위는 “브로드컴이 제출한 시정방안이 법 위반이 결정될 경우에 예상되는 제재 수준과 균형을 이루고 있고, 관련 시장의 거래질서를 개선하는 효과가 있다고 판단해 동의의결 절차를 개시하기로 했다”고 밝혔다. 공정위는 시정방안을 구체화해 잠정안을 마련한 뒤, 의견수렴을 거쳐 최종안을 전원회의에 상정할 계획이다."
"중기부, 영세 소상공인 배달·택배비 월 최대 30만원 지원",박지영,한겨례,2025-02-09,"중소벤처기업부(중기부)가 소상공인을 대상으로 최대 30만원의 배달·택배비를 지원하는 사업을 본격적으로 실시한다고 9일 밝혔다. 이 사업은 지난해 7월 정부가 발표한 소상공인·자영업자 종합 대책 후속 조처의 일환이다. 중기부는 배달·택배를 이용하는 소상공인 67만9천명을 대상으로 예산 2037억원을 투입한다. 중기부는 오는 10일 공고하고, 17일부터 신청받는다고 밝혔다. 이번 사업의 지원대상은 2023년 또는 지난해 연 매출액이 1억400만원 미만으로 배달·택배 실적이 있고, 신청일 기준 폐업하지 않은 개인·법인사업자다. 또한 배달·택배를 주업으로 하는 업종과 소상공인 정책자금 제외업종을 제외한 전 업종을 지원대상으로 한다. 지원금액은 최대 30만이며, 1인당 1개 사업체만 신청할 수 있다. 중기부는 “배달·택배비는 지난해 실적과 과거의 증빙자료를 보관하지 않거나 확인이 어려운 경우를 고려해 2025년까지 실적을 폭넓게 인정한다”고 했다. 신청 절차는 신청자 유형에 따라 ‘신속지급’과 ‘확인지급’으로 나뉜다. 신청단계에서 사업자등록번호를 입력하면, 신속·확인지급 대상 여부를 확인할 수 있다. 신속지급 대상자에 포함된 약 8만개 소상공인은 별도의 증빙자료 없이 사업자등록번호, 계좌번호 등의 정보만 입력하면 지원금을 받을 수 있다. 이들은 배달앱 및 배달대행사들이 중기부에 제공한 배달비 실적을 통해 전산 확인을 할 수 있는 경우다. 신속지급 대상자들은 오는 17일부터 신청할 수 있다. 최초 신청 뒤 지원금이 30만원 미만이더라도 추가 신청 없이 올해 12월까지 배달비 실적이 확인되면, 누적금액 최대 30만원까지 차액을 지급한다. 확인지급 대상자의 경우 모든 택배사, 배달 플랫폼 및 배달대행사, 퀵서비스, 심부름센터 등을 이용해 직접 자료 증빙이 가능하거나, 배달 플랫폼 또는 택배사를 이용하지 않고 소상공인 대표 또는 직원이 상품을 직접 배달(배송)해 증빙이 어려운 경우이다. 확인지급 대상자는 4월 중 해당 사업을 신청할 수 있다. 직접 자료 증빙이 가능한 소상공인은 지난해 1월1일부터 올해 12월31일까지 상품 판매를 위해 배달 또는 택배를 이용한 건에 대한 증빙자료를 제출하면 된다. 증빙자료는 배달·택배비 사용금액이 확인 가능한 전자세금계산서, 택배운송장, 배달 정산내역서 등이 있다. 중기부는 “직접 배달(배송) 소상공인은 특성상 실적에 대한 직접 자료 증빙이 어렵기 때문에 관련 협·단체 등 업계 의견을 충분히 반영해 합리적인 배달·택배비 지급방안을 마련할 예정”이라며 “두 가지 경우 모두 소상공인이 직접 자료를 입력해야 하므로 증빙 방안을 3월 말까지 마련하여 4월부터 신청을 받을 계획”이라고 했다. 사업 신청은 전용 누리집인 ‘소상공인배달택배비지원.kr’이나 ‘소상공인24’를 통해 가능하다. 오는 17일 신청 이후 첫 이틀간은 접속자 분산을 위해 사업자등록번호 끝자리 기준으로 홀짝제를 적용한다. 세부적인 내용은 중기부와 소상공인시장진흥공단 누리집, 소상공인 배달·택배비 지원 콜센터(1533-0500)를 통해 안내받을 수 있다."
