article_name,journalist,publisher,date,article
中딥시크 ‘쇼크’에 SK·삼성도 촉각…AI판도 변화 오나?,박병국,헤럴드경제,2025.01.28,"챗GPTR에 필적하는 중국 인공지능(AI) 딥시크의 등장으로 미국 빅테크가 충격에 휩싸인 가운데 국내 반도체 업계도 촉각을 기울이고 있다. 28일 업계에 따르면 딥시크는 지난해 말 대형언어모델(LLM) ‘V3’를 공개한 데 이어 지난 20일(현지시간)에는 복잡한 추론 문제에 특화한 AI 모델 ‘R1’을 출시했다. 딥시크의 AI 모델이 챗GPT 등과 비슷한 성능을 선보이고 있지만 V3 모델에 투입된 개발 비용이 557만6000달러(약 78억8000만원)에 그쳤다는 소식에 미국 정부와 빅테크도 충격에 휩싸였다. 27일(미국 동부시각) 뉴욕증권거래소에서 나스닥종합지수는 3.07% 급락했고, 스탠더드앤드푸어스(S&P) 500지수는 1.46% 떨어졌다. 특히 AI 칩의 선도적 공급업체인 엔비디아는 하루 만에 16. 97% 폭락했다. 코로나19 초기였던 2020년 3월 이후 최대 낙폭이다. AI 시장 확대로 생성형 AI 모델 학습과 추론에 필요한 그래픽처리장치(GPU) 수요가 급증하면서 GPU 시장을 독점한 엔비디아는 그동안 고성능·고효율을 강조하며 고가 제품을 판매해 왔다. 하지만 딥시크의 AI 모델 훈련에 엔비디아가 중국 수출용으로 성능을 낮춰 출시한 H800 칩이 쓰였다는 사실이 알려지며 엔비디아의 고성능·고비용 전략도 타격을 받을 전망이다. 국내 업계도 상황을 주시하고 있다. 엔비디아에 고대역폭 메모리(HBM)를 사실상 독점 납품하며 고공행진해 온 SK하이닉스와 HBM 5세대인 HBM3E 납품을 위해 품질테스트를 진행 중인 삼성전자에도 단기 영향은 불가피할 전망이다. 다만 업계 관계자는 “일시적으로 매출 감소 등의 우려가 있을 수 있지만, 결국 딥시크도 엔비디아 칩으로 AI 모델을 개발한 만큼 엔비디아의 시장 우위는 당분간 계속될 것”이라고 했다. 하지만 수요와 공급의 변화에 민감한 메모리 산업의 특성상 단기적으로 가격 변동폭이 커질 수도 있다. 일각에서는 AI 리더십을 더 확고히 하겠다는 목표를 설정한 도널드 트럼프 미국 대통령이 향후 첨단산업에 대한 대중국 규제를 강화할 것이라는 우려도 있다. 중국이 이에 대응해 자국 반도체 기업에 대한 지원을 확대하는 등 반도체 자급자족에 한층 속도를 낼 경우 국내 기업의 반도체 수출에도 타격이 있을 수 있다. 장기적으로는 AI 생태계의 저변이 넓어질 수 있어 긍정적이라는 분석도 나온다. 업계 관계자는 “그동안 칩셋이 비싸고 구하기 어려워 AI 시장의 진입 장벽이 높았지만 딥시크가 촉발하는 저비용 구조의 AI 모델이 확대되면 AI 생태계가 더 활발해질 수 있을 것”이라고 했다. 또 다른 관계자는 “한국 기업들은 AI 기술 외에도 고성능 반도체 설계, 첨단 공정 기술 등에서 경쟁 우위를 유지하면서 차별화 전략을 추구해야 한다”며 “적극적인 연구개발(R&D) 투자와 차별화 전략으로 대응해야 할 것”이라고 말했다."
"트럼프 AI투자 한국에 기회?…“금 못캐도, 곡괭이 판 사람 성공”",박병국,헤럴드경제,2025.01.28,"인공지능(AI)의 상용화로 데이터 처리량이 폭발적으로 증가하면서 오는 2030년까지 글로벌 데이터센터 수요가 현재의 3배 이상으로 증가할 할 것이라는 전망이 나왔다. 한국 기업들은 전력 기자재와 에너지저장장치(ESS) 등 전력 솔루션 분야에서는 새로운 시장 점유 기회를 확보할 수 있을 것이라는 분석이 나온다 . 28일 대한무역투자진흥공사(코트라)의 ‘미국 AI 데이터센터 수요 증가에 따른 유망 품목 및 진출 전략’ 보고서에 따르면 글로벌 데이터센터 수요는 2030년까지 3배 이상 늘어날 전망이다. 글로벌 데이터 센터 수요의 절반 이상(51%)은 미국이 차지하고 있다. 2030년에는 미국 내 전체 전력의 8%를 데이터센터로 소모할 것으로 예상된다. 데이터센터 산업은 AI 데이터센터가 주도하고 있다. AI데이터 센터는 AI 모델이 학습하고 예측을 수행할 수 있도록 데이터를 처리하고 계산하는 데 필요한 강력한 컴퓨팅 파워와 대규모 전력 공급 시스템을 갖추고 있다. 북부 버지니아, 댈러스, 시카고, 실리콘밸리를 중심으로 형성된 미국 내 데이터센터 시장은 인구 저밀집 지역으로 확산하는 추세다. 특히 트럼프 대통령이 최근 미국 주도의 AI 합작사 스타게이트를 설립하고, 5000억달러 투자 계획을 발표했다. 오픈AI, 오라클, 일본 소프트뱅크가 함께 미국 내 데이터센터 등 구축에 나설 경우 대규모 시장이 열릴 전망이다. 코트라는 국내외 소프트웨어와 반도체 분야 전문가들의 의견을 종합해, 한국 기업들이 미국 내 데이터센터 시장에 진출하기 위해서는 ‘삽과 곡괭이 전략’을 취해야 한다고 제언했다. 19세기 중반 미국 캘리포니아 골드러쉬 당시 금을 캔 사람은 소수였지만, 금광에서 필요한 삽과 곡괭이를 팔아 성공을 거둔 사람이 많았다는 사례를 접목할 필요가 있다는 것이다. 데이터센터 구축에 필요한 제품과 인프라가 한국 기업에 ‘삽과 곡괭이’ 역할을 할 수 있다는 것이다. 코트라는 특히 전력 기자재와 ESS 등 전력 솔루션 분야에서 새로운 기회가 생길 것으로 내다봤다. 미국 내 인구 밀집 지역과 가까우면서도 전력망 연결이 가능한 데이터센터 부지가 고갈 상태라는 점도 전력 솔루션 분야가 유망할 것이라는 관측에 힘을 싣는다. 새로운 데이터센터를 지을 부지가 부족해졌기 때문에 기존 데이터센터에서 전력을 효율적으로 사용하거나 저장할 솔루션이 더욱 중요해졌기 때문이다. 코트라가 인터뷰한 주문형반도체 및 네트워크 장비 기업의 반도체 엔지니어는 “프로세서 분야는 글로벌 기업이 대부분 밸류체인을 커버하고 있어서 한국 기업이 진입하기는 어려울 것”이라며 “대신 커넥터, 구리 선, 광섬유 등 간접 부품에서 기회를 창출해야 한다”고 말했다."
벤틀리 판매 절반으로 ‘뚝’…“법인 ‘연두색 번호판’ 영향”,박병국,헤럴드경제,2025.01.28,"지난해 1억원 넘는 고가 수입차 판매가 8년 만에 감소한 것으로 나타났다. 경김침체 뿐 아니라 지난해부터 달기 시작한 연두색 번호판이 고가 수입차 판매 감소에 영향을 미친 것으로 보인다. 28일 한국수입자동차협회(KAIDA)에 따르면 지난해 1∼12월 고가 수입차(이하 1억원 이상)는 총 6만2520대 판매됐다. 이는 전년(7만8208대) 대비 20.1% 감소한 수치다. 고가 수입차 판매가 전년 대비 마이너스로 돌아선 것은 2016년 이후 8년 만이다. 전체 수입차 판매에서 고가 수입차가 차지하는 비중도 2023년 28.9%에서 지난해 23.7%로 떨어졌다. 브랜드별로 살펴보면 BMW가 고가 수입차 2만4543대를 팔아 1위를 차지했다. 이어 메르세데스-벤츠(1만9529대), 포르쉐(8254대) 등의 순이었다. 차량 1대 가격이 최소 3억원이 넘는 럭셔리 브랜드인 벤틀리의 판매량은 2023년 810대에서 지난해 400대로 가장 크게(50.6%) 감소했다. 경기 침체가 법인이나 고소득층이 주로 구매하는 고가 수입차 판매에도 영향을 미친 것으로 분석된다. 특히 지난해부터 8천만원 이상 법인차에 연두색 표지판을 부착하게 한 것도 고가 수입차 판매 감소를 이끈 요인으로 꼽히고 있다. 자동차 업계 관계자는 “연두색 번호판이 고가 수입차 판매에 미치는 영향이 매우 큰 것으로 보인다. 취득가를 거짓으로 낮춰 신고하는 ‘꼼수 법인차’ 사례도 등장하고 있어 국토교통부가 조사를 진행 중인 것으로 안다”고 말했다."
“주식 살 돈으로 가입” 목돈 노리는 사람 많구나…신청자 3배 늘었다 [머니뭐니],유혜림,헤럴드경제,2025.01.28,"#. 서울의 한 중소기업에 다는 이재현(가명·32세) 씨는 목돈 마련을 위해 이달 처음으로 ‘청년도약계좌’를 가입했다. 월급 실수령에 생활비를 빼면 빠듯하지만, 국내 증시도 좋지 않은 상황에서 9%가 넘는 수익률을 놓치면 ‘손해’라는 생각 때문이었다. 이 씨는 “그동안에는 ‘차라리 이 돈이면 주식을 사고 말지’라는 생각이 들었는데, 올해는 혜택도 좋아져서 처음으로 가입해봤다”고 말했다. 28일 금융위원회에 따르면, 올 1월 청년도약계좌 가입 신청자 수는 17만명을 돌파해 직전 3개월 평균 신청자 수(6만명)의 약 3배에 달한 것으로 집계됐다. 김소영 금융위 부위원장은 “청년의 금융여건 개선을 위해 다양한 정책적 노력을 꾸준히 추진해 왔다”면서 “특히 올해 1월부터는 청년도약계좌 기여금 지원 확대로 이달 가입 신청자 수가 증가했다”고 설명했다. 시장 불확실성이 커질 때마다 확실하면서도 쏠쏠한 수익률을 보장해 주는 투자처를 찾는 게 중요하다. 이에 재테크 전문가들은 원금 손실 없이 5년 동안 우직하게 목돈을 모으려면 새해 혜택이 더 커진 ‘청년도약계좌’를 주목할 만하다고 조언한다. 청년도약계좌에 가입하기 위해서는 가입일 기준 만 19~34세 이하의 청년이어야 한다. 소득 요건은 직전 과세기간 총 급여액이 7500만원 이하이거나, 종합소득금액 6300만원 이하다. 다만, 직전 3개 과세기간 중 1회 이상 금융소득종합과세 대상에 해당하는 경우에는 가입 대상에서 제외된다. 올해부터는 연 이율 9% 넘는 적금 상품에 가입한 효과를 누릴 수 있을 뿐만 아니라 신용평가 혜택도 새롭게 도입됐다. 먼저, 청년도약계좌 정부 기여금이 월 최대 2만4000원에서 3만3000원으로 늘어난다. 5년 만기 시 최대 60만원을 더 받게 되는 것으로, 이는 연 9.5% 이상 고금리 적금을 든 투자 효과를 낼 수 있다. 지난 한 해에만 106만명의 청년이 신규 가입해 총 157만명이 이 상품을 들고 있다. 통상 청년도약계좌 가입은 매달 초에 신청받는다. 그간 매칭한도(월 40·50·60만원)를 초과해 납입하는 경우, 초과분에 대한 기여금을 받지 못했다. 하지만 올해부터는 모든 소득 구간에서의 매칭한도가 납입한도(월 40만·50만·60만원→월 70만원)까지 늘어나면서 더 많은 만기 자금을 받을 수 있게 됐다. 청년도약계좌는 5년간 매달 70만원 한도로 적금하면 매달 정부 기여금을 더해 5000만원가량의 목돈을 만들 수 있다. 예를 들면, 개인소득 2400만~3600만원 청년이 월 70만원을 납입할 경우 월 최대 2만9000원, 3600만~4800만원 구간의 청년은 월 최대 2만5000원의 기여금을 각각 받게 된다. 수익률뿐만 아니라 다른 혜택도 더 늘어나 눈길을 끈다. 올해부터는 3년 이상 가입을 유지하면 중도에 해지하더라도 비과세 혜택과 기여금의 60%를 지원받을 수 있다. 이는 연 최대 7.64%의 일반 적금 수익을 기대해 볼 수 있는 혜택이다. 또 청년도약계좌 가입을 2년 이상 유지하고 800만원 이상 납입할 경우 최소 5~10점 이상의 신용점수 추가 가점도 받을 수 있다. 금융위는 “금융이력이 부족하다는 이유로 신용도가 낮게 평가되고 있는 청년층의 신용 형성·축적에 도움이 될 것”이라고 기대했다. 하지만 빠듯한 생활에서 큰 목돈이 필요할 때 적금을 깨는 경우도 빈번하다. 이에 금융당국은 결혼이나 출산 등 청년들의 긴급한 목돈 수요를 고려해, 2년 이상 가입자에 한해선 납입원금의 40% 이내 부분인출할 수 있도록 해당 서비스를 올 하반기부터 시행할 예정이다. 향후 활용처도 더 넓어질 전망이다. 2025년 경제정책방향에 따르면, 정부는 적금만 가능했던 청년도약계좌에 금융투자상품 거래를 허용하는 방안도 검토하기로 했다. 한편, 한 펀드매니저는 “만기 된 목돈은 만기매칭형 채권 ETF(상장지수펀드)에 다시 굴리는 것도 방법”이라며 “투자 기간만큼 채권 이자수익을 누릴 수 있고, 향후 금리 하락 시에는 자본차익도 거둘 수 있을 것”이라고 조언했다."
200억원 아파트 시대…용산 ‘나인원 한남’ 최고가 거래,박병국,헤럴드경제,2025.01.28,"지난해 서울에서 30억원 이상 고가 아파트 거래가 직전해보다 크게 늘었다. 28일 국토교통부 실거래가 공개시스템에 따르면 지난해 서울의 30억원 이상 아파트 거래는 모두 2305건(거래 해제건 제외)으로 2023년의 875건보다 2.6배 늘어났다. 강남구와 서초구에 30억원 이상 고가 아파트 거래가 집중됐다. 강남구 거래가 928건으로 40.3%를 차지했다. 서초구 거래는 833건으로 36.1%였다. 강남·서초구 거래가 합쳐서 76.4%다. 용산구(191건), 송파구(142건), 영등포구(113건), 성동구(50건), 양천구(31건)가 뒤를 이었다. 작년에는 100억원 이상 초고가 아파트 거래도 22건 이뤄졌다. 초고가 거래는 용산구에서 9건 있었다. 강남구 6건, 성동구 5건, 서초구 2건이었다. ‘최고가’ 거래는 용산구 한남동 나인원한남이다. 7월 전용면적 273.4㎡가 220억원에 거래됐다. 2위 거래 역시 나인원한남이었다. 6월 273.9㎡가 200억원에 거래됐다. 3위는 서초구 반포동 아크로리버파크 234.9㎡(180억원), 4위는 한남동 파르크 한남 269㎡(170억원), 5위는 성동구 성수동1가 아크로서울포레스트 198.2㎡(145억원)였다. 100억원 이상에 거래된 아파트 대부분이 전용면적 200㎡ 이상이었다. 지난달에는 서초구 반포동 래미안원베일리 134㎡가 106억원에 거래됐다. 3.3㎡(평)당 2억 원이 넘는 다. 100억원 이상 거래는 1년새 큰폭으로 늘었다. 2023년 100억원 이상 거래는 파르크한남(180억원), 아크로리버파크(110억원), 용산구 한남동 한남더힐(110억원·103억원), 성동구 성수동1가 갤러리아포레(100억원) 5건이었다. 50억원 이상∼100억원 미만 거래는 지난해 382건으로 역시 전년(146건)보다 3배 가까이 증가했다. 개별 단지 기준으로는 서초구 반포동에 30억원 이상 아파트 거래가 몰렸다. 반포자이 거래가 92건으로 가장 많았다. 아크로리버파크 84건, 래미안퍼스티지 82건 순이었다. 다음으로 거래 건이 많았던 곳은 영등포구 여의도동 브라이튼여의도(59건), 강남구 도곡동 도곡렉슬(58건), 용산구 이촌동 한강맨숀(37건)이다."
“암호화폐 거래소 신뢰 못하고 정보 비대칭 심해”…투자자 심층 조사 결과 발표,정호원,헤럴드경제,2025.01.28,"비트코인 등 암호화폐 투자자는 암호화폐 시장 불신과 정보 비대칭을 우려하면서도 거래를 하고 있다는 진단이 나왔다. 28일 서울대 소비자학과 최현자 교수팀은 국내 암호화폐 투자자들을 면담한 결과를 정리한 논문을 ‘소비자학연구’ 최신호에 게재했다. 연구진은 암호화폐에 300만원 이상을 투자한 경험이 있는 시민 28명을 연령·성별·직업 등에 따라 선별한 뒤 투자정보를 얻는 방법, 시장에 대한 인식, 거래를 시작한 사유, 투자 후의 변화 여부 등을 심층 조사했다. 연구에 따르면 투자자는 암호 화폐의 발행 배경이나 시세 등에 관한 정보가 부족한 ‘정보 비대칭’ 문제를 겪는 것으로 나타났다. 시중에 유통되는 정보 중에는 부정확한 정보나 극히 소수만 열람 가능한 내용이 많아 ‘정보 탐색이나 분석을 할 필요가 없다’는 반응도 나왔다. 또 백서 등 공식 정보보다 인적 네트워크에서 얻는 정보에 의존하는 경우도 많았다. ‘정보를 추천하는 주체가 나를 속일 가능성이 있는가’를 자문하고 그럴 가능성이 적다면 이를 따른다는 것이다. 암호화폐 발행자와 거래소 등의 신뢰도도 낮았다. 암호화폐 시장을 감독하는 주체가 없고, 과거 시세조작이나 허위·부실 백서 등의 사고가 잇따랐기 때문으로 보인다. 투자자는 암호화폐 투자를 시작한 계기로 ‘여윳돈으로 집안에 도움이 되고 싶었다’, ‘노후 대비의 수단’, ‘부자 옆에 서서 기회를 노리고 싶었다’, ‘돈 공부를 해보고 싶었다’ 등을 답했다. 투자 손실에 대해서는 ‘예방주사’, ‘초연함을 배우는 계기’, ‘성장통’ 등으로 답했다. 또 면담 답변자들은 대체로 포트폴리오 다변화로 위험 분산을 하지 않은 투자를 하는 경향이 나타나기도 했다. 연구진은 “이들은 암호자산 시장에서 성공과 실패 경험을 거듭하며 자신만의 투자철학을 만들어 가고 있는 것으로 보인다”며 “변동성이 크다고 접근을 배제하기보다는 소비자의 권리 보장 방안을 고민해 암호자산이 포트폴리오 다양화에 쓰이는 상품이 될 수 있도록 해야 한다”고 했다."
"“GD처럼 싹 긁어” 카드 결제 얼마나 많으면…유럽 항공권, 5성급 호텔이 ‘공짜’ [머니뭐니]",정호원,헤럴드경제,2025.01.28,"“슈퍼리치들의 카드 세계는 어떨까” 카드 결제 금액이 연간 1억원을 훌쩍 넘어서는 소비를 하는 ‘슈퍼리치’. 고액자산가를 대상으로하는 카드사별 프리미엄 카드의 연회비는 연간 수백만원을 넘나든다. 이들이 받는 혜택을 분석해 봤더니 높은 금액의 연회비를 지급하는 데에는 이유가 있었다. 고액 자산가들가는 평소 대형 항공사를 이용해 해외로 여행과 출장을 떠나며, 5성급 호텔에 머물면서 해외 쇼핑을 즐기는 소비습관을 가지고 있어 카드사에서도 호텔, 항공, 해외쇼핑에 집중한 혜택을 내놓고 있다. 28일 카드 비교 플랫폼 카드고릴라 프리미엄 카드 인기순위에 오른 카드 중 연회비 50만원 이상의 프리미엄군에 속하는 카드 혜택을 비교한 결과, 공통적으로 호텔, 항공, 쇼핑에 집중한 혜택을 선보이고 있었다. 순위에 오른 인기 프리미엄 카드로는 삼성카드 THE iD. TITANIUM(포인트)(연회비 69만5000원), 하나카드 JADE First Centum(연회비 99만5000원), 우리카드 로얄블루1000카드[SKYPASS](연회비 100만원), 현대카드 American Express The Platinum Card®Edition2(연회비 100만원), 대한항공카드 the First Edition2 현대카드(연회비 80만원) 등이 있다. 프리미엄 카드 고객층은 연간 1억원에 육박하는 카드 소비를 하면서 대형 항공사를 이용해 해외로 잦은 여행과 출장을 가고, 5성급 호텔에 머물면서 해외 쇼핑을 이용하는 것이 특징으로 꼽힌다. 일례로 신한카드 The PREMIER GOLD EDITION는 연회비 200만원으로 프리미엄 카드 중에서도 고가의 카드로 꼽힌다. 발급대상은 상장사 CEO, 고액자산가 등으로 40대 이상이 90% 이상이다. 이용자는 상품의 주요 서비스인 항공권 일등석 업그레이드 서비스와 특급호텔 숙박 서비스, 골프 부킹 대행 서비스 등을 선호하는 것으로 나타났다. 한 카드업계 관계자는 “자사의 프리미엄 카드 이용액은 연평균 8400만원 정도”라고 했고, 다른 카드업계 관계자도 “프리미엄 카드 이용객의 월 이용금액은 일반 고객 대비 5배 이상 달한다”면서 “전체 일시불/할부 이용금액 중 해외 일시불 이용금액이 30% 정도 비중을 차지해 해외 이용 관련 부가 서비스 등에 집중한 해외 적립, 바우처 제공 등에 중점을 둔다”고 설명했다. 초고가 프리미엄 라인의 카드는 공통적으로 ‘5성급 호텔’ 바우처를 제공하고 있다. 코로나 이후 호텔 관광 수요가 늘어나면서 고액자산가들을 상대로 한 서비스도 강화하는 것으로 보인다. 해외 여행을 나가 카드를 사용하는 고객이 많은 만큼, 항공권 서비스도 프리미엄 카드를 선택하는 중요한 기준이 된다. 한 카드업계 관계자는 “프리미엄 카드 타깃 이용객의 선호도는 카드사 영업비밀”이라면서도 “초고액 자산가 고객이 선호하는 혜택을 반영해 프리미엄 카드 혜택을 구성한다”고 설명했다. 국내 주요 8개 카드사(신한·KB국민·현대·삼성·비씨·롯데·우리·하나카드)에 따르면 지난 5년간 신규 출시된 신규PLCC(Private Label Credit Card)카드는 총 56종에 달한다. 현대카드가 2015년 국내에 처음으로 PLCC카드를 선보인 이후로 매년 신규 카드가 10종 가까이 등장한 것이다. 신규 PLCC 카드가 가장 많은 카드사는 현대카드(14종)와 롯데카드(15종)이고, 뒤이어 신한카드(10종) 순으로 이어졌다. 카드사가 PLCC카드 출시 경쟁에 나선 이유는 충성 고객을 확보하기 위해서다. 카드수수료 인하 등으로 비용 부담이 커진 카드사가 고객 혜택을 줄이면서 카드별 혜택 변별성이 떨어진 가운데 이탈 고객도 늘어났기 때문이다. 반면 PLCC카드는 브랜드 충성도가 높은 고객이 자발적으로 카드를 발급받게 만들 수 있어 보다 수월하게 충성고객을 확보할 수 있다. 이 때문에 카드사는 따로 PLCC 조직을 운영하며 영업력 확보에도 총력을 기울이고 있다. 현대카드는 본부 단위의 대규모 PLCC 전문 조직을 운영하고 각 브랜드 파트너사의 특성에 최적화된 업무 인프라를 구축하고 나섰다. 롯데카드는 PLCC 기획부서를 따로 운영하며 제휴사와 소통을 진행하고 있다. 적게는 10만원에서 많게는 100만원에 달하는 연회비를 내야 하는 ‘프리미엄 카드’ 고객의 마음을 사로잡는 것이 중요한 과제로 남았다. 한 카드 업계 관계자는 “구매력이 있는 3040고객군을 중심으로 쇼핑 브랜드와 더불어 호텔·항공 등에 대한 소비 트렌드가 꾸준히 이어지고 있어 앞으로도 관련 브랜드사와 협업한 카드 출시가 이어질 것으로 보인다”면서 “2030세대에서도 PLCC 카드가 제공하는 혜택이 연회비 비용을 뛰어넘는다는 것을 경험해 ‘가성비’ 매력을 느끼고 있다”고 설명했다. PLCC카드도 이런 트렌드와 부합하는 쇼핑, 호텔 관련 카드 출시가 주를 이뤘다. 지난 5년간 출시된 56종의 PLCC 카드를 테마별로 분석한 결과, 유통(식음료·생활) 브랜드와 협업한 사례가 13종으로 가장 많았고, 뒤이어 금융사(13종), 호텔·레저(9종), 쇼핑(4종), 교통(3종) 순으로 이어졌다."
