article_name,journalist,publisher,date,article
“트럼프 입에 판 뒤집힌다?” 한국 금리 인하 가능성↑,김은희,헤럴드경제,2025.01.25,"다음주로 예정된 올해 첫 미국 연방공개시장위원회(FOMC) 정례회의 결과에 국내 금융시장이 촉각을 곤두세우고 있다. 미국의 통화정책 방향에 따라 외환시장은 물론 금리, 물가, 증시 등이 민감하게 움직일 수 있어서다. 특히 딱 한 달 뒤 기준금리 변동 여부를 결정해야 하는 한국은행은 FOMC가 내놓을 메시지에 안테나를 예민하게 세우는 모양새다. 25일 금융권에 따르면 미국 연방준비제도(연준·Fed)는 오는 28~29일(현지시간) FOMC 정례회의를 열고 기준금리를 정한다. 시장에서는 연준이 앞서 세 차례 연속 금리를 인하한 데다 인플레이션 반등 우려까지 제기되고 있어 금리를 동결할 가능성이 크다고 관측해 왔다. 연준도 이미 기준금리 인하 속도를 늦추겠다고 여러 차례 공언해 왔다. 그러나 트럼프 대통령이 취임하자마자 공개적으로 금리 인하를 압박하고 나섰다는 점은 변수다. 트럼프 대통령은 지난 23일(현지시간) 스위스 다보스에서 열리고 있는 세계경제포럼(WEF)에 화상으로 참여해 “(연준에) 즉각적인 금리 인하를 요구할 것”이라며 “전 세계적으로 금리가 내려가야 한다”고 언급했다. 그는 같은 날 집무실에서도 제롬 파월 연준 의장과 적절한 시기에 대화하겠다는 의사를 밝히고는 연준이 금리 인하 요구에 응할 것으로 생각하느냐는 질문에 “그렇다”고 답했다. 트럼프의 압박에 연준의 기조가 달라질 경우 1월 기준금리를 동결한 한은으로서는 통화정책 운용의 폭이 넓어질 수 있을 것으로 보인다. 최소한 양국 금리차 확대에 따른 원/달러 환율 상승 압력은 줄어들 수 있어서다. 다만 파월 의장의 독립성 의지가 강한 만큼 금리 동결 기조가 쉽게 꺾이진 않을 것이라는 전망이 아직은 우세한 분위기다. 트럼프 대통령에게 연준을 흔들 만한 법적 권한이 없기 때문이다. 경기 하방 위험이 커지는 상황에서 한은이 2월에는 기준금리를 인하할 것이라는 전망에 무게가 실리고는 있지만 미국의 금리 동결은 한은의 인하 결정을 제약하는 요인으로 작용할 수 있다. 양국 간 금리 차가 벌어지면 환율은 물론 물가에도 부담이 될 수 있기 때문이다. 특히 연준의 금리 동결 직후 30일(현지시간) 유럽중앙은행(ECB)의 금리 인하 결정까지 뒤따르면 달러화 강세 흐름은 증폭될 가능성이 커진다. 환율 불안은 시장의 거센 기준금리 인하 요구에도 한은이 1월 기준금리 동결을 결정한 주된 요인이었다. 지난해 말 장중 1480원대까지 치솟은 원/달러 환율이 1월 금융통화위원회 개최 직전까지만 해도 1460~1470원대를 오갔지만 최근 들어 1430원대로 떨어졌다. 다만 기본적인 달러화 강세 환경이 지속되면 원화 가치 불안정성 위험은 언제든 다시 불거질 수 있다는 게 시장의 공통된 분석이다. 앞서 이창용 한은 총재는 지난 16일 통화정책방향회의 직후 기자회견에서 “경기만 보면 금리를 내리는 것이 당연하지만 환율 변동성이 국내 물가와 금융 안정에 부정적 영향을 미칠 수 있는 상황”이라고 말한 바 있다. 금융당국은 연준의 행보에 따른 금융시장 변동 가능성을 면밀히 모니터링할 방침이다. 비상계엄 사태로 촉발된 국내 정치·경제적 불안에 트럼프 행정부 출범에 따른 글로벌 불확실성까지 겹친 상황에서 시장을 자극할 수도 있다는 우려에서다. 이복현 금융감독원장이 지난 24일 금융상황 점검회의에서 향후 주요한 대외여건 변화 요소의 하나로 연준의 금리 결정을 지목하고 “글로벌 시장 변동성이 커질 수 있으니 언제든 대응할 수 있는 준비태세를 갖춰달라”고 임직원에게 당부한 것도 같은 차원이다. 이 원장은 오는 30일에도 금융상황 점검회의를 열고 FOMC 기준금리 결정에 따른 국내 금융시장 영향에 대해 논의할 예정이다."
"긴 연휴에 늘어난 해외여행객, 면세업계 “특수 기대”",정석준,헤럴드경제,2025.01.25,"설 연휴 기간에 해외여행객이 늘어날 것이라는 전망이 나오자 면세업계의 기대감이 커지고 있다. 25일 국회 국토교통위원회 소속 더불어민주당 염태영 의원이 인천국제공항공사와 한국공항공사로부터 제출받은 자료에 따르면 이달 24일부터 다음 달 2일까지 열흘간 국내에서 운영 중인 6곳의 국제공항에서 총 134만295명(출발 기준)이 해외로 떠날 것으로 집계됐다. 날짜별로는 연휴 이틀째인 25일 15만3000명으로 가장 많은 승객이 해외로 떠날 것으로 예상됐다. 설 당일인 29일은 11만5000명으로 가장 적을 것으로 예측됐다. 열흘간 하루 평균 출발 승객은 13만4000명으로 추산된다. 작년 설 연휴 일평균(11만7000명)보다 13.8% 증가할 전망이다. 면세업계는 해외여행 수요가 증가하는 것을 반기는 분위기다. 면세업계 한 관계자는 “1월 27일이 임시 공휴일로 지정되면서 공항을 찾는 사람이 늘어날 것으로 보고, 이를 어떻게 매출 확대로 연계할지 고민 중”이라고 말했다. 실제 면세업계는 명절 연휴가 있는 기간, 내국인 매출이 증가한다. 지난해 추석이 있었던 9월 내국인 매출은 전년 동기(2469억원)보다 약 10.4% 늘어난 2726억원을 기록했다. 당시 추석 연휴는 주말을 포함해 5일이었다. 업계는 할인 혜택 등을 활용해 설 연휴 고객 잡기에 나섰다. 신세계면세점은 내달 20일까지 온·오프라인 쇼핑지원금 등 다양한 할인 혜택을 제공하는 ‘신세계로 체크인’ 프로모션을 준비했다. 롯데면세점은 내달 2일까지 300개 브랜드를 67% 이상 할인하는 ‘면세일’ 행사를 한다. 신라면세점도 이달 28일까지 고객에게 적립금을 증정하고 있다. 면세업계가 연휴 특수를 반기는 이유는 업황과도 관련있다. 최근 면세업계는 장기 불황을 겪고 있다. 지난해 3분기까지 롯데, 신라, 신세계, 현대 등 국내 면세점 4사의 누적 적자는 1355억원이다. 롯데면세점이 922억원으로 가장 많다. 이어 신라면세점(258억원), 현대면세점(171억원), 신세계면세점(4억원) 순이다."
G마켓-알리 합작법인 기업결합 신고…심사 최대 120일,양영경,헤럴드경제,2025.01.24,"공정거래위원회는 신세계와 중국 알리바바 인터내셔널이 합작회사를 설립하는 내용의 기업결합 신고를 접수했다고 24일 밝혔다. 합작회사의 명칭은 ‘그랜드오푸스홀딩’이며, 이마트 소속 계열사인 아폴로코리아와 알리바바 인터내셔널 소속 계열사인 BK4가 각각 50% 지분을 출자해 설립한다. 기업결합이 완료되면 합작회사는 G마켓과 알리익스프레스코리아 지분을 각각 100% 보유하게 된다. 지난 2003년 이커머스 시장에 본격 진출한 G마켓은 싱글호밍 비중, 멤버십 서비스 가입 비율, 티몬·위메프 사태 이후 쇼핑몰 변경 비중 등에서 모두 시장 내 3위 사업자다. 알리익스프레스코리아는 지난 2023년 한국법인을 설립한 뒤 본격적으로 국내 사업을 시작했다. 상대적으로 저렴하고 다양한 상품을 내세우면서 월간활성이용자수(MAU)는 지난해 12월 기준 약 898만명으로 G마켓(약 527만명)을 추월한 것으로 파악되고 있다. 공정위는 이번 기업결합으로 오픈마켓 시장에서 수평결합을 비롯해 간편결제(SSG페이·스마일페이 등) 시장과 오픈마켓 시장에서의 혼합결합 등 다양한 결합유형이 발생할 것으로 예상했다. 향후 국내 이커머스 시장 등에 미치는 영향이 클 것으로 예상되는 만큼 경쟁사업자·전문가 등의 의견을 폭넓게 수렴한 뒤 공정거래법에서 정한 기준과 절차에 따라 면밀히 심사한다는 방침이다. 기업결합 심사 기간은 신고일로부터 30일이고, 필요한 경우 90일 범위에서 연장(자료 보정기간 불산입)할 수 있다."
"무디스, 삼성전자 신용등급 Aa2로 유지",안세연,헤럴드경제,2025.01.24,"국제신용평가사 무디스가 24일 삼성전자의 선순위 무담보 채권에 대한 신용등급을 ‘Aa2’로 유지했다. Aa2는 Aaa, Aa1에 이어 세 번째로 높은 체계다. 무디스는 삼성전자가 메모리, 디스플레이, 모바일, 가전제품 등 대부분의 핵심 사업 부문에서 ‘강력한 시장 지위와 브랜드’를 가지고 있다고 평가했다. 또 높은 현금 자산을 보유해 Aa2 등급을 유지했다고 설명했다. 다만, 신용등급 전망은 기존 ‘안정적’에서 ‘부정적’으로 하향 조정했다. 무디스는 “메모리 칩 산업, 특히 AI 칩에서 기술 리더십을 회복하는 데 대한 불확실성이 증가했다”며 “향후 12∼18개월간 수익성이 보통(Moderate) 수준을 유지할 것이라는 점을 반영해 등급 전망을 하향 조정했다”고 밝혓다. 신용등급 전망은 향후 변화 가능성에 대한 것으로 신용등급 변경과 다르다. 실제 재무적 영향도 없다. 무디스는 “향후 반도체 부문에서 기술 리더십을 회복하고 영업이익률을 13∼14%로 회복하는 동시에 현재의 건전한 재무 상황을 유지한다면 신용등급 전망을 ‘안정적’으로 변경할 수 있다”고 덧붙였다. 한편 다음달 3일 오후 2시엔 삼성전자의 이재용 회장의 ‘부당합병·회계부정’ 사건의 2심 선고가 나온다. 앞서 1심에선 19개 혐의에 대해 모두 무죄가 선고됐다."
삼성증권 작년 영업익 1조2000억원…전년 대비 62.7%↑,이정환,헤럴드경제,2025.01.24,"삼성증권은 작년 연결 기준 영업이익이 전년 대비 62.7% 증가한 1조2058억원으로 집계됐다고 24일 공시했다. 매출액은 13조4666억원으로 전년 대비 2.3% 증가했고 당기순이익은 전년 대비 64.2% 증가한 8990억원으로 집계됐다. 1주당 현금배당은 3500원으로 결정했으며 주주총회 승인을 거쳐 최종 확정된다. 배당성향은 34.7%로 전년과 대동소이한 수준이다. 삼성증권은 “브로커리지(위탁매매) 매출 및 기업금융(IB), 상품운용손익 증가에 따라 실적이 개선됐다”고 설명했다."
"[속보] 무디스, 삼성전자 신용등급 유지…등급 전망 ‘부정적’ 하향",장연주,헤럴드경제,2025.01.24,"무디스, 삼성전자 신용등급 유지…등급 전망 ‘부정적’ 하향"
"교보생명, 건강·사망·노후 3대 보장 강화한 종신보험 출시",서지연,헤럴드경제,2025.01.24,"교보생명은 보험 하나로 사망 보장은 물론 3대질환까지 평생 든든하게 보장하는 ‘교보3밸런스보장보험(무배당)’을 25일부터 판매한다고 24일 밝혔다. 이 상품은 생애주기에 맞춰 건강과 사망, 노후까지 한 번에 보장하는 종신보험으로 평생 사망 보장을 받으면서 3대질환(암∙뇌혈관질환∙허혈심장질환) 진단 시 치료비보장, 납입면제, 연금전환 등 3대 보장을 받을 수 있는 것이 특징이다. 우선 보험료 납입완료 후 암이나 2대질환(뇌혈관질환∙허혈심장질환)으로 진단 받으면 주요 치료 시마다 가입금액의 30%를 최대 10년간 반복 보장한다. 암주요치료는 암의 직접적인 치료를 목적으로 하는 암수술, 항암방사선치료, 항암약물치료이며, 2대질환주요치료는 뇌혈관질환, 허혈심장질환의 직접적인 치료를 목적으로 시행되는 수술, 혈전용해치료, 중환자실 치료를 말한다. 예컨대, 주계약 가입금액 1억 원 가입 시 암 진단을 받은 후 10년 내에 암주요치료를 받게 되면 치료를 받은 해당 연도에 연간 3000만 원씩, 10년간 최대 3억 원을 받을 수 있다. 또 암주요치료 외에 2대질환으로 주요치료 시에도 매년 3000만 원씩, 10년간 최대 3억 원을 중복 보장 받을 수 있다. 또한 암, 특정뇌혈관질환, 특정허혈성심장질환으로 진단 받으면 보험료 납입이 면제되고 보장은 평생 유지돼 경제적 부담을 줄일 수 있다. 납입기간(5,7년납의 경우 10년) 이후에는 3대질환 주요치료비 보장은 그대로 유지하면서 사망보장을 연금으로 전환해 매년 연금을 받을 수 있는 것도 장점이다. 특히, 연금전환 이후 3대질환으로 진단 받으면 10년간 기본연금액의 3배를 지급해 장기간 치료비와 생활비로 활용할 수 있다. 상급종합병원 3대질환 주요치료는 물론 최신 암치료∙수술, 뇌혈관∙허혈심장질환 수술, 혈전용해치료 등도 특약을 통해 폭넓게 보장한다. 교보생명 관계자는 “고객의 생애주기에 맞춰 건강∙노후보장까지 종신보험의 영역을 확장한 상품”이라며 “사망 보장은 물론 3대질환 치료비보장, 납입면제, 연금전환 등 혜택을 더해 고객의 건강한 삶과 균형 있는 보장을 돕는 든든한 동반자가 될 것으로 기대한다”고 말했다. 이 상품은 만 15세부터 최대 75세까지 가입할 수 있다. 보험료 납입기간은 5·7·10·12·15·20·30년납 중 선택 가능하다. 주계약 가입금액 5000만 원 이상 가입 시 일상 속 건강케어, 질환 집중케어, 주요질병 돌봄케어 등을 이용할 수 있는 ‘교보New헬스케어서비스’가 제공된다. 한편, 교보생명은 유병력자와 고령자를 위한 ‘교보간편3밸런스보장보험 (무배당)’도 25일 출시한다. ▷3개월 내 질병 확정진단·의심소견, 입원·수술·추가검사 필요소견 ▷2년 내 질병·사고로 인한 입원·수술 ▷5년 내 암·간경화·파킨슨병·루게릭병·투석중인 만성신장질환으로 인한 진단·입원·수술 이력이 없으면 가입할 수 있다. 평생 사망보장을 받으며 3대질환 진단 시 치료비보장, 납입면제, 연금전환 등 3대 보장을 받을 수 있다. 주계약 5000만 원 이상 가입 시 유병자를 위한 ‘교보New헬스케어서비스(R)’이 제공된다."
작년 12월 가계대출 금리 5개월 만에 하락에도…예대차 4개월 연속 확대,김은희,헤럴드경제,2025.01.24,"지난해 12월 기준 가계대출 금리가 5개월 만에 하락 전환한 것으로 나타났다. 은행권의 가산금리 인상 효과가 줄어든 영향으로 풀이된다. 다만 예금금리도 함께 내리면서 예대금리차(예금·대출 금리 차이)는 더욱 벌어진 것으로 파악됐다. 한국은행이 24일 발표한 ‘금융기관 가중평균 금리’ 통계에 따르면 2024년 12월 예금은행의 신규취급액 기준 가계대출 금리는 연 4.72%로 전월보다 0.07%포인트(p) 내렸다. 이는 같은 해 8월(4.08%) 이후 5개월 만의 하락 전환이다. 그간 가계대출 금리는 은행권이 금융당국의 가계대출 억제 압박을 명분으로 가산금리를 올리면서 상승세를 보여온 바 있다. 가계대출 가운데 주택담보대출은 4.30%에서 4.25%로 0.05%p, 일반신용대출은 6.17%에서 6.15%로 0.02%p 각각 하락했다. 주택담보대출 종류별로는 고정형 금리(4.23%)가 0.08%p 내린 반면 변동형 금리(4.32%)는 0.07%p 상승했다. 김민수 한은 금융통계팀장은 “지표금리인 은행채 5년물 금리가 하락한 가운데 은행권의 가산금리 인상 효과가 줄어 가계대출 금리가 하락했다”고 밝혔다. 은행연합회에 따르면 은행채 5년물 금리(AAA)는 지난해 11월 3.21%에서 12월 3.00%로 0.21% 하락했다. 기준금리 인하에도 변동형 대출 금리가 오른 데 대해선 “고정형 대출의 지표금리인 은행채 5년물 금리가 크게 하락한 것과 달리 변동형 대출의 지표금리인 코픽스는 지난해 12월 대출 적용 기준으로 0.03% 정도 하락하는 데 그쳤기 때문”이라고 설명했다. 김 팀장은 향후 흐름과 관련해 “변동금리 대출은 기준금리 인하 효과가 작용할 것으로 보고 있고 고정금리 대출의 경우 은행채 5년물과 가산금리가 어떻게 되느냐에 달렸는데 은행이 가산금리를 올해 들어 인하하기 시작해 장기 시장금리가 상승하지 않는다면 완만한 하락세를 보일 것”이라고 전망했다. 기업대출 금리(4.62%)도 단기 시장금리가 하락한 영향 등으로 0.14%p 내렸다. 대기업 대출(4.60%)과 중소기업 대출(4.65%)에서 모두 내림세를 보였다. 가계와 기업을 통틀어 전체 은행권 대출금리는 한 달 새 4.76%에서 4.64%로 0.12%p 내렸다. 지난해 9월(4.62%) 이후 4개월 만에 하락 전환이다. 다만 같은 기간 예금금리는 더욱 큰 폭으로 떨어진 것으로 확인됐다. 예금은행의 신규취급액 기준 저축성 수신(예금) 금리는 연 3.21%로 0.14%p 떨어졌다. 정기예금 등 순수저축성예금 금리(3.22%)와 금융채·양도성예금증서(CD) 등 시장형 금융상품 금리(3.17%)가 모두 0.14%p씩 하락했다. 이에 은행의 신규 취급액 기준 대출 금리와 저축성 수신 금리의 차이, 즉 예대금리차는 1.43%p로 전월(1.41%p)보다 0.02%p 커졌다. 4개월 연속 확대다. 잔액 기준 예대 금리차도 2.24%p에서 2.29%p로 0.05%p 벌어졌다. 올해 1월 들어 일부 은행이 가산금리를 인하하고 있는 만큼 예대금리차도 점차 좁혀질 것으로 김 팀장은 관측했다. 은행 외 금융기관의 1년 만기 정기 예금·예탁금 기준 수신금리는 모두 내렸으며 대출금리(일반대출 기준)도 상호금융을 제외하고 모두 하락했다. 기관별로는 예금금리가 상호저축은행(3.44%), 신용협동조합(3.41%), 상호금융(3.26%), 새마을금고(3.44)에서 각각 0.17%p, 0.03%p, 0.04%p, 0.02%p 하락했다. 대출금리는 상호저축은행(10.93%)과 신용협동조합(5.17%), 새마을금고(4.69%)가 각각 0.57%p, 0.08%p, 0.15%p 내렸고 상호금융이 4.84%에서 4.90%로 0.06%p 올랐다."
“설날 부모님 용돈 30만원이 적당”…그럼 조카는 얼마?,최원혁,헤럴드경제,2025.01.24,"설날 용돈 적정 금액으로 부모님은 30만원, 조카는 5만원이 적합하다는 조사 결과가 나왔다. 24일 커뮤니티 플랫폼 당근은 지난 20일부터 22일까지 ‘설날 용돈 적정 금액’을 조사한 결과, 조카 용돈으로 적합한 금액은 5만원이라는 응답이 전체의 38%로 가장 많았다고 밝혔다. 이어 10만원(28%), 3만원(14%) 등 순이었다. 또 부모님 등 웃어른에게 드리는 용돈으로는 30만원(31%)이 적당하다는 답변이 1위였다. 이어 50만원(22%), 20만원(20%) 등이 뒤를 이었다. 물가 상승 영향으로 세뱃돈이 크게 늘어난 것으로 나타났다. 카카오페이는 24일 송금봉투 데이터를 분석한 결과 지난해 설 연휴기간 중고등학생들이 받은 세뱃돈 평균은 7만4000원으로 나타났다고 밝혔다. 이는 2021년 평균 5만4천원과 비교해 1.4배 높은 수치다. 카카오페이는 물가상승 등 영향으로 10만원 이상 세뱃돈을 받는 중고등학생이 늘어났기 때문이라고 분석했다. 부모님께 드리는 용돈 평균은 약 20만원으로 집계됐다. 한편 카카오페이에서 ‘중고등학생에게 주는 세뱃돈 얼마가 적당할까’를 주제로 22~23일 진행한 투표에 따르면 참가자 7만8000여명 가운데 65%가 5만원이 적정하다고 답했다. 이와함께 설날 가장 피하고 싶은 잔소리로는 ‘이제 슬슬 결혼해야지’(34%), ‘살 좀 빼야겠다’(29%), ‘연봉은 얼마나 되니’(19%), ‘취업 준비는 잘 되니’(12%) 등 순으로 꼽혔다."
김성태 기업은행장 “경제의 시장 안전판 역할 충실히 수행”,김벼리,헤럴드경제,2025.01.24,"김성태 IBK기업은행장이 24일 “IBK가 ‘대한민국 금융의 등대’로 우뚝 설 수 있도록 경제의 시장 안전판 역할을 충실하게 수행하고, 이를 실천하기 위해 현장 업무역량 강화와 혁신에 도전하는 조직문화를 확산해야 한다”고 강조했다. 김 행장은 이날 열린 ‘전국 영업점장 회의’에서 이같이 말했다. 전국 영업점장 회의는 올해 경영전략 방향과 추진 과제를 공유하는 자리다. 회의는 정기 인사와 조직 개편이 끝난 직후 열렸다. 김성태 행장을 비롯해 자회사 사장단과 국내외 영업점장 등 임직원 900여명이 참석했다. 김 행장은 지난 한 해 여러 대내외 불확실성 속에서도 중소기업대출 역대 최대 점유율을 달성하는 한편, 소상공인·중소기업의 위기극복 지원에 앞장서 준 직원들에게 감사하다고 말했다. 이어 올해 경영슬로건으로 ‘고객가치 최우선 IBK’를 제시했다. 이어 차별화된 고객가치를 제공하기 위한 5대 전략방향으로 ▷고객 중심 경영 ▷탄탄한 수익 기반 구축 ▷미래 성장동력 확보 ▷조직 자긍심 강화 ▷지속가능 금융 등을 제시했다. 김 은행장은 “불확실한 시기일수록 본원적 경쟁력을 강화해야 하며, 은행의 본원적 경쟁력은 차별화된 고객가치로부터 나온다”며며 “기업 생애주기별 지원체계 완성, 중소기업 디지털화 등 IBK만의 차별화된 중소기업 지원체계 마련에 각별한 관심과 노력을 기울여달라”고 당부했다. 마지막으로 실효성 있는 내부통제 시스템 완전 정착과 임직원 모두의 인식 개선도 거듭 강조했다. 한편 이날 회의에서는 ‘행복한 삶과 올바른 소통을 위한 조언’이라는 주제의 명사특강과, 성과 우수 영업점장을 격려하기 위한 깜짝 가족방문 등 영업점장들의 마음건강을 챙기는 다양한 프로그램도 준비됐다."
이복현 금감원장 “일본 금리 인상에도 엔캐리 청산 유인 낮아”,김은희,헤럴드경제,2025.01.24,"금융감독원이 24일 일본은행(BOJ) 금리 인상과 관련해 급격한 엔캐리(금리가 낮은 엔화로 금리가 높은 나라의 자산에 투자) 청산은 나타나지 않을 것이라고 전망했다. 금감원은 이날 이복현 원장 주재로 금융상황 점검회의를 열고 BOJ 금리 인상에 따른 시장 영향 등을 점검했다. BOJ는 이날까지 이틀간 열린 금융정책결정회의에서 기준금리인 단기 정책금리를 현재 ‘0.25% 정도’에서 ‘0.5% 정도’로 인상하기로 했다. 금감원은 “시장 일부에서는 작년 BOJ 금리 인상 후 발생한 급격한 엔캐리 청산에 따른 시장 충격 재발을 우려하기도 하지만 엔캐리 청산 유인은 낮다”면서 “현재 금융 상황을 작년 7월과 비교하면 BOJ 금리 인상은 동일하지만 작년에는 미·일 간 금리 격차가 축소되고 엔화도 강세였던 반면 현재는 금리 격차가 커지고 엔화도 약세”라고 설명했다. 이복현 원장은 “작년에도 BOJ 금리 인상 직후 발표된 미국 고용지표 악화로 경기침체 우려가 부각되며 시장 충격이 발생한 만큼 향후 대외여건 변화를 면밀히 모니터링할 필요가 있다”고 진단했다. 이 원장은 “설 연휴 중에도 미국 연방준비제도(Fed·연준) 및 유럽중앙은행(ECB) 금리 결정, 미국 물가 지표 발표 등에 따라 글로벌 시장 변동성이 커질 수 있다”며 “언제든 대응할 수 있는 준비 태세를 갖춰달라”고 임직원에게 당부했다. 미국 도널드 트럼프 2기 행정부 출범과 관련해서는 “트럼프 정책 동향을 면밀히 모니터링해 유관기관과 협업을 강화하고 필요한 대응책도 마련해달라”고 강조했다."
"DB손해보험, 개인용 자동차보험료 0.8% 인하",서지연,헤럴드경제,2025.01.24,DB손해보험은 오는 4월초 책임개시 계약부터 개인용 자동차보험료를 0.8% 인하할 예정이라고 24일 밝혔다. DB손보는 보험요율 검증 등 준비를 거쳐 인하된 보험료를 적용할 계획이다. 이에 따라 가입자 1인당 보험료는 평균 7000원 가량 낮아질 전망이다. DB손보는 지난해 개인용 자동차보험료를 2.5% 내린 바 있다. 지난 2022년 이후 4년 연속 보험료를 인하하는 셈이다. DB손보 관계자는 “물가 상승과 경기침체가 장기화하는 상황에서 서민들의 경제적 고통을 분담하고자 자동차보험료를 인하하기로 결정했으며 최종적인 보험료 인하율과 반영 시기는 요율 검증 일정 등에 따라 일부 변동될 수도 있다”고 말했다.
