article_name,journalist,publisher,date,article
"교보생명, ‘보험순익’ 급증에 3분기 누적 당기순익 9000억원 돌파",서지연,헤럴드경제,2025.01.31,"교보생명이 보장성보험 포트폴리오를 강화하며 보험손익이 개선세를 이어가고 있다. 특히 보험손익이 46% 급증해 보장성 포트폴리오를 늘린 결과가 실적으로 나타났다는 분석이다. 31일 교보생명에 따르면 지난해 3분기 누적 당기순이익은 9399억원으로 전년 동기(7428억원) 대비 26.5% 늘었다. 세전이익 가운데 보험손익은 5572억원으로, 전년 동기(3814억원) 대비 46% 급증해 호실적을 견인했다. 보험사의 영업이익은 크게 보험손익과 투자수익으로 나뉜다. 보험손익은 보험영업수익에서 보험서비스비용을 차감한 금액을 말한다. 새 국제회계기준(IFRS17) 도입으로 보험손익은 보험사업 자체 이익을 나타내며, 보험영업 수준을 보여주는 지표로 활용되고 있다. 교보생명 관계자는 “보험영업 부문에서 좋은 실적을 올린 데에는 건강보험을 비롯한 보장성보험 포트폴리오를 강화한 것이 주효했다”고 설명했다. 지난해 교보생명 포트폴리오 가운데 보장성보험 비중은 크게 늘었고, 보장성보험 가운데 건강보험 비중이 확대되고 있다. 지난 1년간 교보생명의 보장성보험 신계약 월납 규모는 전년대비 60% 가량 증가했다. 종신보험뿐 아니라 암·뇌·심장질환 등을 보장하는 건강보험의 신계약 월납 규모도 전년 대비 약 150% 늘었다. 교보생명은 지난해 고객이 평생 건강을 지키며 균형 있는 보장을 준비할 수 있도록 건강보험 상품을 연이어 출시했다. 암보험, 뇌·심장보험, 종신보장 건강보험, 맞춤형 종합건강보험, 유병자보험, 암간병평생보장보험 등 건강보험 상품 포트폴리오를 다변화했다. 보장성 포트폴리오 강화로 인해 보험계약 유지율도 올랐다. 지난해 상반기 기준 직전 1년간 13회차 유지율은 88.7%로 2023년 말 대비 10% 포인트 이상 상승했다. 13회차 계약 유지율은 보험 가입 후 매월 보험료 납입이 13회 이상 이뤄진 계약의 비중이다. 최근 생명보험업계는 단기납 종신보험 환급률, 보험계약마진(CSM) 산정 관련 규제 강화의 영향으로 건강보험 시장에 집중하고 있다. 교보생명도 올해 종신보험뿐만 아니라 건강보험 경쟁력 강화에 초점 맞춰 건강보험 상품 라인업을 다양화할 예정이다. 교보생명은 지난달 중순 경영조직 개편을 통해 상품마케팅실 산하에 별도의 건강보험사업부(건강보험상품담당)를 신설했다. 단순한 상품 출시를 넘어 건강보험 상품 전략부터 상품 개발 및 마케팅까지 전 과정에서 차별화된 고객가치를 제공하기 위해서다. 지난달 교보생명은 ‘교보치매·간병안심보험’, 종신보험에 3대질환 특화보장을 강화한 ‘교보3밸런스보장보험’ 등 건강보험 상품을 잇따라 출시했다."
"한국필립모리스, 전 제품에 ‘위기가구 발굴·지원’ 문구 새긴다",강승연,헤럴드경제,2025.01.31,"한국필립모리스는 1월부터 생산하는 모든 담뱃갑 내부에 ‘위기가구 발굴·지원’ 홍보 문구(사진)를 적용한다고 밝혔다. 한국필립모리스는 지난해 행정안전부와 위기가구 발굴 홍보 동참을 위한 협약을 체결했다. 작년에는 테리아, 말보로 브랜드 제품 4종에 홍보 문구를 적용했다. 1월부터는 적용 범위를 전체 50종으로 넓혔다. 또 약 1800개 편의점에서는 디지털 광고보드를 통해서도 홍보 문구를 송출해 소비자에게 알릴 계획이다. 한국필립모리스 관계자는 “기업 시민의 일원으로 행정안전부와 위기가구 발굴 홍보 지원을 이어갈 수 있어 뜻깊다”며 “복지 사각지대 해소와 사회적 안전망 강화에 보탬이 되길 바란다”고 전했다."
"“안심하고 스키 타자”···롯데손보, ‘스키 보험’ 출시",박성준,헤럴드경제,2025.01.31,"롯데손해보험이 겨울철 스키·보드 이용자를 위한 맞춤형 보험상품을 출시했다. 나이·성별과 상관없이 1000원대 저렴한 보험료로 가입할 수 있다. 롯데손보는 새해 겨울 스포츠를 즐기다 일어나는 사고에 대한 보장을 담은 보험서비스 ‘스키 레저 상해보험’을 출시했다고 31일 밝혔다. 이 보험은 나이·성별에 상관없이 1800원의 보험료로 스키, 보드 등 겨울 스포츠를 즐기는 만 19세~59세 고객이 다쳤을 때 보장받을 수 있도록 만든 상품이다. 골절 진단·수술비, 깁스 치료비 등 상해 위험만 보장하는 ‘최적가 플랜’과 고객이 집을 나선 뒤 스키를 즐기고 귀가할 때까지 교통사고 등 모든 위험을 보장받을 수 있는 ‘끝판왕 플랜’ 등 2종류로 구성된다. 특히 끝판왕 플랜에 가입하면 ▷스키 중 다치고 후유장해 진단 시 최대 3000만원 ▷골절 진단 시 50만원 ▷깁스 치료 시 30만원 ▷교통사고처리지원금(동승자 포함) 최대 3000만원 ▷운전자벌금 최대 3000만원까지 보장받을 수 있다. 한편, 롯데손보는 ‘모나 용평리조트’와 업무제휴를 맺고, 안전사고에 대비하는 고객이 손쉽게 가입할 수 있도록 스키장 슬로프 입구·매표소 앞에 QR코드 입력기를 마련했다."
한은 “美 IT 증시 변동성 확대…금리인하 불확실성 높다”,홍태화,헤럴드경제,2025.01.31,"한국은행이 미국 금리인하 관련 불확실성이 높아졌다고 강조했다. 미국 통화당국이 기준금리를 동결하고, 앞으로도 신중한 결정을 하겠다고 밝히면서다. 관세 등 도널드 트럼프 미국 대통령 관련 불확실성이 커지면서 경제 여건 전망도 한층 더 어려워졌다. 정보통신(IT) 관련 증시 변동성도 경고했다. 저비용·고성능 인공지능(AI) 모델을 발표한 중국 딥시크(DeepSeek) 때문에 기존 AI 시장을 주도하며 오름세를 이어온 미국 빅테크 기업이 흔들릴 수 있다는 분석이다. 유상대 한은 부총재는 31일 시장상황 점검회의를 개최하고 “미 연준의 금리인하 시기 및 속도, 미국 신정부의 경제정책 추진, 국내 정치 상황 등과 관련한 불확실성이 여전히 높은 만큼 관련 리스크 요인들의 전개 양상과 그 영향을 경계감을 가지고 점검해 나갈 것”이라며 이같이 밝혔다. 연방준비제도(Fed)는 지난 29일(현지시간) 연방공개시장위원회(FOMC)를 열어 기준금리를 4.25∼4.50%로 동결했다. 연준은 지난해 9월 ‘빅컷’(0.50%포인트 인하)을 시작으로 금리인하 사이클을 개시한 뒤 작년 12월까지 세 차례 연속 인하를 단행했으나, 이번 동결 결정으로 연속 인하 기조가 깨졌다. 제롬 파월 미국 연방준비제도 의장은 이와 관련 기자회견에서 “우리는 통화정책 기조 변화를 서두를 필요가 없다”고 강조했다. 오는 3월 금리 인하에 대한 질문에도 “통화정책 기조 변화를 서두를 필요가 없다”고 말했다. 이에 시장에선 연준이 상당히 ‘매파적(긴축)’으로 돌아섰다고 보고 있다. 미국 증시 호황을 주도한 IT 증시 변동성도 설 연휴 사이 커졌다. 중국 스타트업인 딥시크가 자사 AI 모델을 훈련하는데 550만달러가 조금 넘는 비용이 들었다고 주장했기 때문이다. 그동안 AI 인프라에 수십억달러를 지출한 대형 기술기업의 경쟁력에 의구심이 제기됐다. 유 부총재는 “주초 주요 빅테크 기업의 AI 과잉투자 우려 부각했고, 미 신정부의 관세정책 관련 불확실성 등으로 글로벌 위험회피 심리가 강화했다”며 “연휴 기간 중 미 증시 변동성이 IT 부문을 중심으로 상당폭 확대된 만큼 국내 파급 영향을 예의 주시해야 할 것”이라고 경고했다."
뒤늦은 딥시크 충격에 코스피 2510선 ‘출렁’…SK하이닉스 8% 급락 [투자360],신주희,헤럴드경제,2025.01.31,"코스피가 설 연휴 후 개장 첫날인 31일 중국 인공지능(AI) 스타트업 딥시크 충격을 뒤늦게 반영하며 2510대로 밀려났다. 이날 오전 9시 23분 기준 코스피 지수는 전장보다 23.08포인트(0.91%) 내린 2513.72를 나타내고 있다. 지수는 전장 대비 2.47포인트(0.10%) 내린 2,534.33으로 약보합 출발했지만 개장 직후 단숨에 낙폭을 키웠다. 중국 딥시크 충격과 미 연방공개시장위원회(FOMC)의 기준금리 동결 등 악재를 한 번에 반영하며 변동성이 커졌다는 설명이다. 유가증권시장에서 외국인은 5388억원 순매도 중이고 개인과 기관은 각각 2903억원, 2436억원 순매수하고 있다. 코스피200선물 시장에서 외국인은 2067억원 매도 우위를 보이고 있다. 이날 서울 외환시장에서 달러 대비 원화 환율은 전 거래일보다 14.7원 오른 1,446.0원으로 거래를 시작했다. 간밤 뉴욕증시는 장중 큰 변동성을 보인 가운데 다우존스30산업평균지수는 0.38% 올랐고, 스탠더드앤드푸어스(S&P)500지수와 나스닥종합지수는 각각 0.53%, 0.25% 상승 마감했다. 중국 딥시크 충격에 지난 27일 폭락했던 엔비디아는 이날 0.77% 올랐고 TSMC(2.88%), 브로드컴(4.51%) 등 미국 반도체주 전반이 올랐다. 중국 딥시크 등장으로 AI 산업 구도가 흔들릴 것이라는 전망이 나오는 가운데 현 AI 생태계의 일원인 SK하이닉스는 8.37% 급락한 20만2500원에 거래되고 있다. 삼성전자(-2.42%), 한미반도체(-6.72%) 등 다른 반도체주도 동반 약세다. 한편 NAVER(5.88%), 카카오(4.62%) 등 소프트웨어 종목은 강세를 보이고 있다. LG에너지솔루(-1.13%), POSCO홀딩스(-1.15%) 등 이차전지주와 현대차(-0.73%), 기아(-0.59%) 등 자동차주는 내리고 있다. 반면 KB금융(2.36%), 신한지주(3.0%), 메리츠금융지주(3.29%) 등 금융주는 오르고 있다. 업종별로 보면 전기·전자(-3,79%), 기계·장비(-3.12%), 의료정밀(-1.85%), 건설(-1.60%) 등은 하락하고, 음식료·담배(0.76%), 운송장비(0.70%), 유통(0.51%) 등은 상승 중이다. 같은 시각 코스닥 지수는 전장보다 4.08포인트(0.56%) 내린 724.66을 기록 중이다. 지수는 전장 대비 3.78포인트(0.52%) 내린 724.96으로 출발해 하락세가 이어지고 있다. 코스닥시장에서 외국인은 113억원 순매도 중이고 개인과 기관은 각각 135억원, 20억원 순매수하고 있다. 시가총액 상위 종목 중 에코프로비엠(-2.39%), 에코프로-1.15%), 리가켐바이오(-0.65%) 등은 내리고, 알테오젠(0.69%), HLB(2.02%), 삼천당제약(5.17%) 등은 오르고 있다."
"빙그레, 인적분할·지주사 전환 철회에 9% 하락",강승연,헤럴드경제,2025.01.31,"빙그레가 인적분할과 지주회사 전환 계획을 철회한 영향으로 31일 장 초반 9%대 약세를 보이고 있다. 이날 오전 9시 35분 현재 빙그레는 전 거래일보다 9.67% 내린 7만1000원에 거래 중이다. 장중 10.81% 내리며 7만원선도 위협했다. 빙그레는 직전 거래일인 24일 이사회 결의를 통해 분할계획에 대한 진행 사항과 분할계획서 일체를 철회하기로 했다고 공시했다. 회사는 계획 철회 배경으로 “이해관계자와 소통한 결과 더 명확한 주주가치 제고 방안 마련이 필요하고, 추후 사업의 전개 방향이 분명히 가시화된 뒤 인적분할 및 지주회사 추진을 하는 것이 적절하다고 판단했다”고 설명했다. 빙그레는 지난해 11월 인적분할로 ‘빙그레’(가칭)를 설립해 음·식료품의 생산과 판매를 독립적으로 운영하고, 분할 존속회사인 ‘빙그레홀딩스’(가칭)는 지주회사로 전환해 투자와 사업 포트폴리오를 전략적으로 관리하겠다고 밝혔다."
"日서 급성장한 LVMH, ‘원정 쇼핑’ 효과? [세모금]",강승연,헤럴드경제,2025.01.31,"루이비통, 크리스찬 디올 등 내로라하는 명품 브랜드를 거느린 루이비통모에헤네시(LVMH)가 지난해 전 세계적인 소비 부진에도 일본에서 두 자릿수 성장세를 기록했다. 엔저 현상으로 원정 구매를 온 관광객의 영향으로 분석된다. 31일 LVMH 실적 보고서를 보면, 지난해 매출은 847억유로(약 127조원)로 전년 대비 1.7% 줄어들며 감소 전환했다. 다만 M&A(인수·합병), 환율 변동 등 영향을 제외한 유기적 기준으론 1% 성장했다는 설명이다. 같은 기간 영업이익은 189억유로(약 28조원)로 16.2% 감소했으며, 순이익은 18.8% 줄어든 130억유로(약 20조원)를 기록했다. 사업부문별로는 매출의 절반을 차지하는 패션·가죽 부문의 매출은 411억유로(약 62조원)로 전년 대비 11.2% 급감했다. 패션·가죽 부문은 루이비통, 디올, 펜디, 셀린느 등 명품 패션 브랜드의 매출을 포함한다. 코로나19 보복소비 흐름이 약화하며 타격을 입었다. 시계·주얼리(106억유로)과 주류(59억유로)도 전년 대비 각각 3.0%, 11.2% 감소했다. 가격이 상대적으로 저가인 향수·화장품(84억유로)만 1.8% 증가세를 나타냈다. 지역별 매출에선 일본의 성장세가 두드러졌다. 지난해 일본 지역 매출은 75억유로(약 11조원)로 명품의 본고장인 프랑스(70억유로)를 제쳤다. 전년 대비 성장률은 18.4%로 압도적이었다. 일본을 제외한 아시아 지역 매출은 232억유로(약 35조원)로 여전히 많았지만, 전년 대비 12.5% 감소했다. 프랑스와 유럽 지역 매출은 각각 2.6%, 2.8% 늘었다. 미국은 1.0% 줄었다. 그간 LVMH를 비롯한 명품 기업들이 중국을 중심으로 성장 가도를 지속한 것을 고려하면 달라진 분위기가 감지된다. 일본 엔화 약세로 인해 일본을 방문한 해외 관광객의 명품 구매가 늘어났기 때문이다. LVMH도 실적 보고서에서 “유럽과 일본에서 중국 고객 지출이 크게 증가했다”고 밝혔다. 국내 소비자들의 원정 구매도 유행처럼 번졌다. 셀린느와 디올의 경우, 국내보다 낮은 정가에 엔저까지 더해지며 10%가량 저렴하게 살 수 있다는 ‘꿀팁’이 입소문 나기도 했다. LVMH는 한국 시장 매출을 별도로 집계하지는 않았다. 다만 높은 명품 수요가 지속되는 만큼, 한국을 겨냥한 마케팅도 예상된다. LVMH 보고서에 따르면 지난해 셀린느가 연 플래그십 스토어 3곳은 서울과 일본 오사카, 프랑스 파리뿐이었다. 로에베도 지난해 서울 청담동에 국내 최초 단독 매장인 ‘까사 로에베’를 열었다. 리모와는 기존에 사용하던 제품을 보완해 재판매하는 리크래프티드 프로그램을 독일, 일본에 이어 한국에서 3번째로 시작했다."
작년 4분기 다단계업체 4곳 문 닫아…상호·주소 자주 바꾼 업체도 2곳,양영경,헤럴드경제,2025.01.31,"지난해 4분기 다단계판매업체 4개가 폐업하고 6개가 신규 등록한 것으로 조사됐다. 한 업체가 최근 3년간 5회 이상 상호·주소를 바꾼 경우도 2건 파악됐다. 공정거래위원회는 31일 이런 내용이 담긴 ‘2024년도 4분기 다단계판매업자의 주요 정보 변경 사항’을 공개했다. 지난해 말 기준 다단계판매업 등록업체는 121개 사로 집계됐다. 4분기 중에는 신규등록 6건, 폐업 4건, 상호·주소·피해보상보험 변경 13건 등 총 23건의 변경사항이 발생했다. 폐업한 업체는 에코프렌·씨엔커뮤니케이션·브레인그룹·비앤하이브 등 4곳이다. 인산헬스케어·셀럽코리아·엔지엔·하담스·메타웰코리아 등 5곳은 한국특수판매공제조합과 공제계약을, 리만코리아는 직접판매공제조합과의 공제계약을 통해 소비자피해보상보험계약을 체결하고 관할 시도에 신규로 등록했다. 관련법상 다단계판매업체는 소비자 피해보상을 위해 공제조합과 공제계약을 체결하거나 은행·보험사 등과 채무지급보증계약 등 소비자 피해 보상보험계약을 체결해야 한다. 최근 3년간 한 업체가 5회 이상 상호·주소를 변경한 경우도 2건(아이야유니온·테라스타)으로 파악됐다. 공정위는 “다단계판매업자와 거래하거나 다단계판매원으로 활동하고자 한다면 거래 과정에서 발생할 수 있는 피해 예방을 위해 해당 사업자의 다단계판매업 등록, 휴·폐업 여부와 같은 주요정보를 꼭 확인해야 한다”면서 “상호나 주된 사업장 주소 등이 자주 바뀌는 사업자의 경우 환불이 어려워지는 등 예상치 못한 피해가 발생할 가능성이 있는 만큼 이런 업체와 거래할 때는 더욱 주의할 필요가 있다”고 밝혔다. 공정위는 또 “소비자 피해보상보험이 해지된 다단계 판매업자는 정상적인 영업을 할 수 없다”며 “해당 업체에 특히 주의해야 한다”고 강조했다."
주52시간 예외 ‘반도체 특별법’ 2월 통과하나...노동계는 규탄 대회,김용훈,헤럴드경제,2025.01.31,"야당이 주52시간 노동상한제 적용 예외에 입장 변화를 보이면서 반도체 특별법이 2월 임시국회에서 통과할 가능성이 높아졌다. 31일 정치권과 정부 관계자에 따르면 이재명 더불어민주당 대표는 2월 3일 반도체 산업 종사자의 주 52시간 상한제 적용에 예외를 두는 내용 등을 담은 반도체 특별법 관련 ‘정책 디베이트(토론)’를 주재한다. 민주당은 정책 방향에 이견이 있을 때 공개토론을 벌여 왔다. 반도체 특별법은 이 대표가 직접 전향적 검토 가능성을 시사하며 변화 기류가 감지되고 있다. 그간 민주당은 ‘화이트칼라 이그젬션(고소득 전문직 근로 시간 규율 적용 제외)’ 등 노동시간 관련 조항을 특별법에 포함하는 데 부정적인 입장을 보여왔다. R&D 업무가 반도체 업종에만 국한된 게 아니라는 이유에서다. 특히 현행 근로기준법에 마련돼 있는 특례 제도를 활용하면 된다는 게 민주당의 주장이다. 민주당의 입장 변화에 한국노총과 민주노총 등 노동계는 2월 3일 국회 정문 앞에서 반도체 특별법 노동시간 적용 제외 시도를 규탄하는 기자회견을 연다. 한국노총은 “장시간 노동을 철폐하고 주4일제를 추진하겠다던 더불어민주당 역시 이재명 대표가 직접 좌장을 맡아 반도체 특별법 관련 정책 디베이트를 개최하는 등 부화뇌동하며 군불을 때고 있다”면서 “반도체 특별법은 특정 산업·직군 노동자에게 노동시간 적용에 대한 예외를 허용함으로써 노동조건의 최저 기준을 법정화한 근로기준법을 사실상 무력화시키는 악법 중의 악법”이라고 주장했다. 다만 민주당 내에서도 국회 환경노동위원회 의원들을 중심으로 반도체 특별법 통과는 불가하다는 목소리가 여전히 거세다. 현행 특별 연장근로 방식으로도 충분하다는 게 이들의 주장이다. 박홍배 의원이 고용노동부에서 받은 자료에 따르면 지난해 1월1일부터 11월30일까지 특별 연장근로 신청 건수는 총 6112건이었다. 이 중 연구개발을 위한 신청은 26건(0.4%)에 그쳤다. 근로기준법 상 근로 시간은 주40시간이 기본으로, 최대 12시간까지 연장근로가 가능하다. 이렇게 총 주52시간을 초과해 일한 경우 사업주는 처벌 대상이다. 단 불가피한 사정이 있는 경우 근로자 동의와 고용부 장관의 인가를 받아 근로 시간을 연장할 수 있도록 특별 연장근로제도를 두고 있다. 연장근로는 근로자 건강에 영향을 미칠 수 있으므로 사유는 ▷재해·재난 ▷인명·안전 ▷돌발상황 ▷업무량 폭증 ▷R&D 등 모두 다섯 가지에 한정된다. 반도체업계는 경쟁력 강화를 위해선 R&D 인력에 대한 주52시간 상한제 특례가 필요하다고 주장했지만, 정작 연구개발을 위한 특별 연장근로 신청이 26건(0.4%)에 그쳤다는 건 경쟁력 강화와 근로 시간의 상관관계가 떨어진다는 주장이다. 이용우 의원은 지난 2023~2024년 R&D 분야에서 고용부가 특별 연장근로를 승인한 23건 중 22건은 삼성전자였고, SK하이닉스는 단 1건도 없었다며 반도체 기업의 위기는 근로 시간과 무관하다고 주장했다. 이 의원이 고용부 자료를 분석한 결과 삼성은 지난해 10월 말까지 3개월(12주) 단위로 15차례에 걸쳐 1658명의 R&D 인원을 대상으로 주 12시간씩 총 23만8752시간의 특별 연장근로를 실시했다. 2023년에는 7회에 걸쳐 1358명 대상 19만5552시간을 연장근로를 실시했다. 같은 기간 삼성을 제외한 반도체 기업의 특별 연장근로 승인은 비메모리 반도체를 생산하는 LX세미콘(2024년 1회)이 유일하다. 반면, SK하이닉스는 지금까지 한 번도 특별 연장근로를 실시하지 않았다. 이 의원은 “특별 연장근로에 따른 삼성 R&D 노동자들의 근로 시간을 고려하면 주52시간 예외가 아니라 노동자의 건강권과 휴식권, 인간의 존엄성을 위해 오히려 근로 시간 단축이 필요한 상황”이라며 “근로기준법을 무력화할 수 있는 근로 시간 예외 적용은 매우 신중해야 한다”라고 강조했다. 한편 최상목 대통령 권한대행은 지난 13일 권영세 국민의힘 비상대책위원장을 예방해 반도체산업 특별법 등 민생 법안 처리를 위한 국정협의회 활성화를 당부했다. 최 대행은 “여야정이 참여하는 국정협의회가 활성화되길 희망한다”며 “이를 통해 국회에 계류 중인 반도체특별법, 국가기간전력망확충법 등 민생 법안들이 조속히 통과됐으면 좋겠다”고 말했다."
"무신사, AI 애드테크 기업 ‘몰로코’와 맞손…추천 적중률 높인다",전새날,헤럴드경제,2025.01.31,"무신사가 최근 머신러닝 솔루션 기업 몰로코(Moloco)와 ‘AI(인공지능) 추천 기술 고도화를 위한 전략적 업무협약(MOU)’을 체결하고, ‘추천 적중률’을 개선한다고 31일 밝혔다. 협약에 따라 양사는 무신사 스토어 내에서 입점 브랜드를 위한 추천 기술 고도화에 나선다. 취향에 맞는 상품을 찾는 과정이 간소화되고, 플랫폼에 대한 신뢰도는 높아질 것으로 기대된다. 입점 브랜드는 새로운 고객층을 확보할 수 있다. 향후 무신사는 몰로코와 협업해 1500만 회원과 8000개 이상의 입점 브랜드가 유기적으로 연결되는 최적의 추천 시스템을 선보일 계획이다. 무신사 관계자는 “앞으로도 고객 경험을 개선하고, 브랜드 성장을 돕는 플랫폼으로 시스템을 개선할 것”이라고 말했다. 한편 몰로코는 구글, 아마존 등 실리콘밸리 출신 머신러닝 엔지니어들이 2013년 설립한 글로벌 머신러닝 기업이다. AI 기반 추천과 노출 시스템을 전문적으로 다룬다. 현재 미국, 영국, 독일, 한국 등 전 세계 13개국에 지사를 두고 있다."
