article_name,journalist,publisher,date,article
"1월 수출 10.3%↓,16개월만에 마이너스…설연휴 조업일수 감소 영향(종합)",배문숙,헤럴드경제,2025.02.01,"［헤럴드경제=배문숙 기자］지난달 우리 수출이 설 연휴로 인한 조업일수 감소 등 영향으로 전년 동월보다 10% 넘게 감소했다. 이로써 수출 플러스 행진은 16개월만에 마이너스로 전환됐다. 다만 우리 수출 1등 품목인 반도체 수출은 9개월 연속 100억달러 이상을 달성하며 견조한 실적을 이어갔다. 정부는 이달 ‘수출전략회의’를 통해 금융·물류·인증·마케팅 등 수출 전 분야에 걸친 즉각적이고 실효성 있는 대책을 모두 담은 ‘범정부 비상수출대책’을 발표할 계획이다. 또 관세전쟁을 선포한 도널드 트럼프 2기 미 행정부의 정책 동향을 실시간으로 모니터링하고 업계와 함께 대응방안을 면밀히 점검키로 했다. 1일 산업통상자원부에 따르면 1월 수출액은 491억2000만달러(통관 잠정치)로 작년 같은 달보다 10.3% 감소했다. 우라 수출은 2023년 10월 전년 동월 대비 증가율이 플러스로 전환된 뒤 작년 12월까지 15개월 연속 플러스 기록을 이어왔으나 1월에 그 흐름이 멈췄다. 다만, 조업일수 영향을 고려한 지난달 일평균 수출은 전년 동월 대비 7.7% 증가한 24.6억 달러로 2022년(25.2억 달러)에 이어 역대 1월 중 두 번째로 높은 수치를 기록했다. 산업부는 “작년에는 2월에 있던 설 연휴가 올해 1월로 옮겨오면서 조업 일수가 4일 감소한 영향 등으로 1월 수출이 줄었다”면서 “다만 이는 일시적인 현상으로, 일평균 수출로 보면 작년보다 8% 정도 증가했다”고 설명했다. 최대 수출품인 반도체 수출은 101억달러로 작년보다 8.1% 증가했다. 반도체 수출은 9개월 연속 100억달러 이상을 기록하며 15개월 연속 전년 대비 수출 플러스 흐름을 이어갔다. 반도체에 이어 수출 2위 품목인 자동차는 조업일수 감소영향으로 19.6% 줄었다. 차부품(-17.2%), 석유제품(-29.8%) 등도 감소했다. 국가별로는 9대 주요시장에서 역성장을 기록했다. 대(對)중국 수출은 춘절 연휴(1월28일~2월4일) 영향으로 14.1% 감소한 92억 달러에 불과했다. 대미국 수출도 주요 수출품목인 자동차·일반기계 수출이 줄면서 9.4% 감소한 93억 달러를 기록했다. 이로써 지난달은 대미국 수출액은 중국으로의 수출액을 앞섰다. 1월 수입액은 510억달러로 작년 대비 6.4% 감소했다. 이로써 1월 무역수지는 18억9000만달러 적자를 나타냈다. 월간 무역수지는 2023년 6월 이후 19개월 연속 흑자를 이어왔으나 1월 적자로 돌아섰다. 안덕근 산업부 장관은 “지난달은 장기 설 연휴로 인해 조업일수가 전년 동월대비 크게 감소하면서 수출이 일시적으로 둔화됐다”면서 “다만 조업일수 영향을 고려한 일평균 수출이 전년 동월 대비 7.7% 증가한 만큼, 우리 수출 모멘텀은 여전히 살아있다”고 평가했다. 이어 “수출이 우리 경제에 버팀목이 될 수 있도록 민관 원팀으로 가용한 모든 자원을 집중 지원하겠다”면서 “이달 중 ‘수출전략회의’를 열어 ‘범정부 비상수출대책’을 발표, 수출의 우상향 모멘텀을 유지하겠다”고 말했다. 그러면서 “미 신정부 출범 이후 새로운 무역·통상 정책이 지속적으로 발표되고 있는 만큼, 업계와 함께 이에 대한 대응방안을 면밀히 점검하여 우리 수출기업에 미치는 부정적 영향이 최소화될 수 있도록 총력 지원하겠다”고 강조했다. 한편, 트럼프 미 대통령은 1일(현지시간)로 예정된 캐나다, 멕시코, 중국에 대한 관세 부과와 관련, “캐나다, 중국, 멕시코가 지금 관세를 막기(forestall) 위해 할 수 있는 것은 아무것도 없다”고 말했다. 앞서 캐롤라인 레빗 백악관 대변인은 이날 브리핑에서 “트럼프 대통령은 내일(2월1일) 멕시코와 캐나다에 대한 25% 관세, 중국에 대한 10% 관세 부과를 시작하리라는 것을 확인(confirm)한다”고 밝혔다. 트럼프 대통령은 또 이 자리에서 향후 수개월 내에 철강, 알루미늄, 석유, 가스, 의약품, 반도체 등에도 관세를 부과할 것이라고 밝혔다고 블룸버그 통신이 전했다. 그는 원유와 가스에 대한 관세는 다음 달 18일께 부과될 것 같다고 언급했다."
"1월 수출 10.3% 감소, 16개월만의 마이너스…“설에 따른 조업일수 감소 영향”",서경원,헤럴드경제,2025.02.01,"작년보다 일렀던 설 연휴로 인한 조업일수 감소 등 영향으로 한국의 1월 수출이 10% 넘게 감소했다. 주력 상품인 반도체 수출은 9개월 연속 100억달러 이상을 달성하며 견조한 실적을 이어갔다. 산업통상자원부는 1일 이 같은 내용의 1월 수출입 동향을 발표했다. 1월 수출액은 491억2000만달러로 작년 같은 달보다 10.3% 감소했다. 한국의 수출은 2023년 10월 전년 동월 대비 증가율이 플러스로 전환된 뒤 작년 12월까지 15개월 연속 플러스 기록을 이어왔으나 1월에 그 흐름이 멈췄다. 산업부는 “작년에는 2월에 있던 설 연휴가 올해 1월로 옮겨오면서 조업 일수가 4일 감소한 영향 등으로 1월 수출이 줄었다”면서 “다만 이는 일시적인 현상으로, 일평균 수출로 보면 작년보다 8% 정도 증가했다”고 설명했다. 최대 수출품인 반도체 수출은 101억달러로 작년보다 8.1% 증가했다. 반도체 수출은 9개월 연속 100억달러 이상을 기록하며 15개월 연속 전년 대비 수출 플러스 흐름을 이어갔다. 한국의 1월 수입액은 510억달러로 작년 대비 6.4% 감소했다. 이로써 1월 무역수지는 18억9000만달러 적자를 나타냈다. 월간 무역수지는 2023년 6월 이후 19개월 연속 흑자를 이어왔으나 1월 적자로 돌아섰다."
"“딥시크, AI 시장파괴자 아닌 혁신촉매 가까워”",서경원,헤럴드경제,2025.02.01,"중국이 선보인 생성 AI(인공지능) ‘딥시크’가 세계 AI 산업과 증시를 발밑에서 흔들고 있다. 최신 AI 반도체 없이 매우 싼 값에 ‘챗GPT’ 등 최정상 AI에 맞먹는 모델을 만들어 ‘AI 개발은 고비용이 불가피하다’는 업계 통념을 무너뜨렸다. 지난달 20일 세상에 모습을 드러낸 추론 AI 모델 ‘딥시크 R1’은 극한의 ‘가성비’로 돌풍을 일으켰고, 이 여파에 AI 칩 대표주 엔비디아는 같은 달 27일 하루에만 주가가 17% 폭락하며 시가총액 846조원이 증발했다. 기세가 걷잡을 수 없자 시장 일각에서는 딥시크가 AI 시장을 초토화하는 만화속 ‘파괴 신(神)’이 아니냐는 평까지 나왔다. 한국 증시도 설 연휴가 끝난 직후인 지난 달 31일 한발 늦은 딥시크 충격에 SK하이닉스 등 반도체 종목이 대거 급락하면서 하락세로 마감했다. 그러나 AI 학계와 금융투자업계의 견해를 종합하면 딥시크는 모든 틀을 망가뜨리는 ‘종결자’라기 보다는 현 시장을 더 풍성하게 만드는 ‘혁신 촉매’에 더 가까워 보인다. 오픈AI의 ‘챗GPT’와 구글 ‘제미나이’ 등 종전 AI 모델들을 몽땅 대체한다고 보기 어렵다는 얘기다. 이와 관련해 먼저 주목해야 할 딥시크의 특성은 누구나 무료로 가져다 쓸 수 있는 ‘오픈소스’(개방형 소프트웨어)라는 점이다. 이 AI를 개발한 동명의 기업 딥시크(중국명 深度求索)는 자사 모델의 가중치(weight) 등 핵심 데이터를 인터넷에 공개해, 누구나 이를 가져가 상업적 용도로 활용하거나 개조할 수 있도록 허용했다. 가중치는 AI의 ‘인공신경망’을 구성하는 수치 뭉치로, AI의 능력을 발동시키는 ‘톱니바퀴’ 부품에 흔히 비유된다. 이런 오픈소스 AI는 챗GPT나 제미나이 등 폐쇄형 AI와는 전혀 다른 영역의 상품이다. 폐쇄형 AI는 가중치 등 작동 메커니즘을 비공개로 묶어두고 타인 사용 시 요금이나 광고 열람 같은 대가를 요구한다. 오픈소스와 폐쇄형은 시장에서 서로를 대체하지 않으면서 나란히 성장한다. 컴퓨터 운영체계(OS) 시장에서 오픈소스 ‘리눅스’와 폐쇄형 ‘윈도’가 함께 전체 파이를 키워온 것이 좋은 예다. 딥시크 출시 전 대표적인 오픈소스 AI로는 페이스북 운영사 ‘메타’가 내놓은 ‘라마’(Llama)가 있었지만, 라마는 폐쇄형 AI보다 성능이 떨어져 활용에 제약이 있었다. 이 때문에 AI 업계에서는 챗GPT의 최고급 추론 모델인 ‘o1’에 맞먹을 정도의 실력을 지닌 딥시크가 오픈소스로 풀리면 파급효과가 매우 클 것으로 본다. AI 서비스 회사나 스타트업이 딥시크를 고쳐 검색·교육·번역·상담 등 작업에 특화한 고도 모델을 대거 내놔 시장에 활력을 줄 수 있다는 것이다. 특히 딥시크는 개발과 운영에서 GPU(그래픽카드) 등 전산 자원을 종전 AI보다 훨씬 적게 소모해 비용을 크게 줄일 수 있을 것으로 보인다. 국내 AI 개발사의 한 관계자는 “예전보다 선택의 폭이 훨씬 넓어졌고 중국 AI가 미국을 바짝 추격했다는 사실에서 놀라움이 느껴진다”며 “딥시크도 파인튜닝(세부조정) 등에 GPU 인프라가 꽤 필요하지만, 이 정도 여건이라면 다양한 AI 제품이 충분히 많이 나올 것으로 본다”고 설명했다. 이런 기대감은 지난달 31일 증시에서도 나타났다. 타사의 AI 모델을 토대로 애플리케이션(응용프로그램) 상품을 개발하는 소프트웨어 기업들은 하락장에서도 오히려 몸값이 뛰었다. 네이버(6.13%), 카카오(7.27%), 이스트소프트(11.24%), 더존비즈온(4.25%) 등이 대표 사례다. 특히 지금껏 국내 AI 소프트웨어 업계는 미국 빅테크(대형기술기업)들이 AI 혁신을 독식하며 단순 ‘팔로워’(시장 추종자)로서 부진이 컸는데, ‘딥시크 생태계’가 열리면서 새로운 성장 동력을 발굴할 공산이 커졌다. 오픈AI, 마이크로소프트, 구글 등 기존 AI 강호들은 오픈소스 강자의 등장으로 새 차별점을 고민해야 할 처지가 됐다. 반면 이를 계기로 이런 AI 빅테크들이 비용을 낮추고 모델 품질을 더 끌어올리는 등 심기일전의 계기로 삼을 수 있다는 해석도 적잖다. AI 학계의 한 관계자는 “딥시크는 상대적으로 소규모 모델이라 경제성이 좋은 대신 대형 AI보다 환각(엉뚱한 답변을 내뱉는 현상) 리스크가 커질 수 있다. 비유하자면 부품을 사 와 집에서 조립하는 PC가 낫냐, 브랜드 PC가 더 좋냐의 차이인데, 긴장 속에 서로 혁신을 촉진해 ‘윈윈’(상호이득)이 됐으면 좋겠다”고 설명했다. 딥시크 열풍의 가장 큰 피해자는 엔비디아, SK하이닉스, 삼성전자 등 AI 하드웨어 기업들이다. 딥시크가 ‘AI 칩을 많이 쓸수록 AI의 성능이 좋아진다’는 불문율을 깨면서 AI 인프라의 과잉 투자에 대해 경계심이 높아졌기 때문이다. 반면 금투업계에서는 딥시크란 ‘메기’의 등장으로 AI 산업의 효율이 높아지면서 장기적으로는 AI 인프라 수요가 더 커질 것이라는 예측도 나온다. 이때 많이 언급되는 경제 원리가 ‘제번스의 역설’(Jevon‘s Paradox)이다. 이는 19세기 영국 경제학자 윌리엄 제번스가 석탄의 소비를 연구하면서 고안한 원리로, 산업의 효율성이 증가하면 자원 소비가 절감되지 않고 오히려 늘어난다는 것이 골자다."
구글처럼 우리도 항만 내 데이터센터 건립 길 열리나…정부 검토 착수,서경원,헤럴드경제,2025.02.01,"인공지능(AI) 모델·서비스 개발의 핵심 인프라로 꼽히는 데이터센터를 항만 내에 지을 수 있도록 허용하는 방안을 정부가 검토하고 있다. 1일 관계 당국에 따르면 과학기술정보통신부는 데이터센터 건립 난항을 해소하기 위해 기업 활동 관련 인프라와 전력 공급 시설이 잘 갖춰진 항만 부지에 데이터센터를 지을 수 있도록 하는 방안을 검토해 줄 것을 해양수산부에 요청했다. 항만에 입주할 수 있으려면 데이터센터가 항만 시설로 인정받아야 하는데 현행 법령상 일부 부합하지 않는 측면이 있다. 데이터센터의 항만 내 건립을 위해서는 항만법상 요건에 부합하지 않는 부분에 대한 규제를 면해주도록 시행령 개정이 필요해 과기정통부의 요청에 따라 양 부처가 협의를 진행했다는 설명이다. 과기정통부 관계자는 “해양수산부 측에서도 시행령 개정에 대한 긍정적 시각을 보였다”고 전했다. 다만, 데이터센터 건립을 위한 실제 항만법 시행령 개정 시기 등 구체적인 사항은 아직 정해지지 않았다. 데이터센터는 방대한 양의 AI 학습·추론을 위해 대규모 서버를 모은 집적시설로 AI 시대 필수 인프라로 꼽히는 반면, 전자파 발생 우려와 전력 수급 문제 등으로 도시 인근에 건립하기 쉽지 않은 문제가 있다. 구글이 2011년 핀란드의 항구도시인 하미나에 데이터센터를 짓는 등 전력과 냉각수 공급이 용이하고 낮은 인구 밀도로 주민 반대 우려가 높지 않은 항만과 배후단지가 데이터센터 증설 부지의 대안으로 꼽힌다."
엔비디아 ‘줍줍’ 나선 서학개미…딥시크 충격에도 지난주에만 8000억 순매수 [투자360],서경원,헤럴드경제,2025.02.01,"중국의 스타트업 딥시크 등장으로 인공지능(AI) 투자의 효율성 문게가 부각되면서 AI 대장주인 엔비디아의 주가가 출렁거렸지만, 국내 투자자의 관련 주식과 상장지수펀드(ETF) 매수세는 지속됐다. 1일 한국예탁결제원에 따르면 지난달 24∼30일 국내 투자자는 엔비디아를 3억1712만1619달러(약 4614억원) 순매수 결제했다. 순매수 순위 2위다. 엔비디아 수익률을 2배 추종하는 레버리지 ETF인 ‘그래니트셰어즈 2배 롱 엔비디아 데일리 ETF’도 2억3734만6697달러(3451억원) 순매수했다. 또한 ‘일드맥스 엔비디아 옵션 인컴 스트래티지 ETF’와 ‘디렉시온 데일리 엔비디아 불 1.5배 셰어즈 ETF’는 각각 2559만1025달러(372억원), 667만924달러(97억원) 순매수 결제했다. 이 기간 국내 투자자가 가장 많이 순매수한 해외 주식은 ‘디렉시온 데일리 반도체 불 3배 ETF’로, 3억3554만2985달러(4874억원) 순매수 결제했다. 이처럼 국내 투자자의 엔비디아 매수세가 지속하고 있지만 최근 주가 흐름은 좋지 않다. 엔비디아는 딥시크가 저비용으로 고성능의 AI 모델을 개발한 사실이 알려지면서 주가가 크게 출렁였다. 비싼 엔비디아의 신형 칩 구매에 천문학적인 비용을 들이지 않아도 되는 것 아니냐는 의문이 제기됐기 때문이다. 엔비디아 주가는 지난 27일(현지시간) 16.97% 폭락했다가 이튿날에는 8.93% 반등했다. 증권가에서는 딥시크의 등장이 일단 엔비디아에는 좋지 않은 환경이라고 분석하면서도 빅테크 기업의 설비투자(CAPEX) 지속 여부를 확인할 필요가 있다고 말했다. 김일혁 KB증권 연구원은 “비용 부담이 크고 공급이 적은 초고성능 GPU(그래픽 처리 장치)보다 비용이 한 단계 낮은 고성능 GPU의 수요 증가세가 강할 전망인데, 독점 중인 초고성능 GPU 시장보다 경쟁 중인 고성능 GPU 시장 확장세가 커지는 건 엔비디아에 부담”이라고 진단했다. 이어 그는 “중국의 AI 추격 속도가 상당하다는 걸 깨달은 미국 정부는 AI 반도체 규제에 더욱 적극 나설 전망”이라면서 이는 “엔비디아에 좋지 않은 환경”이라고 말했다. 박유악 키움증권 연구원도 “딥시크 충격은 CSPs(클라우드 서비스 공급자)의 투자 우선 순위를 하드웨어에서 ‘알고리즘과 강화 학습 개발’로 바꾸는 계기가 될 수 있고, 무료로 풀린 딥시크-R1은 오픈AI 생태계 전반에 대한 수익성 우려를 야기할 수 있다”면서 “(엔비디아) 주가의 단기 반등이 있을 수 있지만 중장기적으로는 보수적 접근이 바람직해 보인다”고 말했다. 서영재 대신증권 연구원은 “이번 (딥시크) 발표가 개선된 모델을 만들기 위해 더 많은 컴퓨팅 파워가 필요하다는 사실을 바꾸는 것은 아니고, 엔비디아 12개월 선행 P/E(주가수익비율)가 29배 수준으로 과거 5년 밴드 하단 수준에 위치해 있어 밸류에이션 매력에 반등 가능한 구간으로 판단한다”고 말했다. 그러면서 “향후 추세 상승을 위해서는 기업들이 AI 모델을 발전시킬 효율적인 방법이 나왔음에도 더 강력한 AI 모델을 만들기 위해 CAPEX를 유지한다는 부분이 확인될 필요가 있다”고 부연했다. 한편, 금융투자협회는 지난달 24일 기준 투자자 예탁금이 54조1443억원, 신용거래융자 잔고는 16조6844억원인 것으로 집계했다. 일주일 전보다 각각 2조8742억원, 1789억원 증가했다. 머니마켓펀드(MMF)는 195조5641억원으로 한 주 전 대비 9조5979억원 감소했다."
"[속보]1월 수출 10.3%↓,16개월만에 마이너스…설 연휴 조업일수 감소 영향",배문숙,헤럴드경제,2025.02.01,"［속보］1월 수출 10.3%↓,16개월만에 마이너스…설 연휴 조업일수 감소 영향"
“한국 금리인하 또 발목 잡히나” 트럼프 관세 폭탄에 고환율 공포 커진다,홍태화,헤럴드경제,2025.02.01,"미국 관세 정책이 현실화하면서 원/달러 환율이 또 1450원대를 넘어섰다. 미국이 기준금리를 동결한 가운데 고환율 리스크까지 부상해 엎친 데 덮친 격이다. 도널드 트럼프 미국 대통령 취임에 따른 달러 강세까지 본격화하는 모양새다. 우리나라 통화당국 입장에선 딜레마다. 급격하게 위축하고 있는 내수를 살리기 위해선 금리 인하란 처방이 필요한데, 문제는 원화 가치 하락이다. 앞서도 고환율에 한국은행 금융통화위원회는 기준금리를 동결했다. 미국과의 금리 차이 부담에 더해 고환율 제약이 커지면서 통화당국이 금리 인하를 놓고 환율에 또 한 번 발목이 잡힐 수 있다는 우려가 커지고 있다. 1월 31일 서울 외환시장에서 미국 달러화 대비 원화 환율의 주간거래 종가는 전 거래일(24일 오후 3시30분 기준)보다 21.4원 뛴 1452.7원으로 나타났다. 지난 17일(1458.3원) 이후 가장 높다. 오후 12시56분께엔 1456.3원까지 치솟기도 했다. 1일(한국시간) 새벽 2시 기준으로는 직전 거래일인 지난 24일 서울환시 종가 대비 22.20원 상승한 1453.50원에 거래를 마쳤다. 이번 장 주간 거래(9시~3시30분) 종가 1452.70원 대비로는 0.80원 높다. 트럼프 변수가 작용했다. 트럼프 대통령은 2월 1일부터 멕시코와 캐나다에 25% 관세를 부과하겠다는 기존 입장을 재확인했다. 관세가 부과되면 미국 내 물가 부담이 올라간다. 금리 인하가 어려워진단 얘기고, 이는 곧 달러 강세를 의미한다. 실제로 미국 연방준비제도(Fed)는 지난 29일(현지시간) 연방공개시장위원회(FOMC) 정례회의에서 기준금리 목표 범위를 연 4.25~4.50%로 유지했다. 연준은 지난해 9월 ‘빅컷’(0.50%포인트 금리인하)을 시작으로 금리인하 사이클을 개시한 뒤 작년 12월까지 세 차례 연속 인하를 단행했으나, 이번 동결 결정으로 연속 인하 기조가 깨졌다. 제롬 파월 미국 연방준비제도 의장은 이와 관련 “우리는 통화정책 기조 변화를 서두를 필요가 없다”라고 말했다. 오는 3월 금리 인하를 여전히 고려 중이냐는 질문에도 “통화정책 기조 변화를 서두를 필요가 없다”고 말했다. 트럼프 행정부의 불확실성도 직접 거론했다. 그는 “관세·이민·재정정책, 규제와 관련해 어떤 일이 일어날지 아직 알 수 없다”고 강조했다. 결국 대외여건은 다시 달러 강세로 흘러가는 모양새다. 중장기적으로 달러 가치가 높은 수준에서 유지될 가능성이 커졌고, 자연적인 환율 안정을 기대하기 어렵게 됐다. 우리나라 통화당국 입장에선 경기 부양도 급하지만 그렇다고 과감하게 기준금리를 인하하기도 어려운 상황이 됐다. 이미 미국보다 1.50%포인트나 낮은 기준금리를 고수하고 있는 상황에서 나 홀로 금리를 낮추게 되면 원화 체력은 더 약화할 수밖에 없다. 미국 금리 인하가 다시 속도를 내지 않는다면 우리나라도 속도조절이 불가피한 셈이다. 앞선 1월 13일 기준금리 결정 때도 높은 환율과 미국의 매파적 금리 기조가 금리 인하를 막았다. 이창용 한국은행 총재는 1월 13일 금리를 동결한 뒤 기자회견에서 “정세에 따라 (금리 인하 여부를) 판단하는 게 더 신중하고 바람직하다”고 설명했다. 시장에서는 이에 금리 인하 강도가 약해질 수밖에 없다고 보고 있다. 다만, 경기가 워낙 안 좋은 만큼 2월 금리 인하는 예상대로 단행한 뒤 추이를 볼 가능성이 아직까진 높다. 지난해 우리나라 실질 국내총생산(GDP)은 애초 한은 전망치(2.2%)보다 0.2%포인트나 낮은 2.0% 성장하는 데 그쳤다. 특히 4분기 성장률(전분기대비)은 저조한 건설투자(-3.2%) 등의 영향으로 0.1%에 불과했다. 경기가 급격하게 위축하는 상황에서 2월 금리까지 시장 예상과 달리 묶으면 자칫 경기를 살릴 기회를 놓칠 수 있다. 김정식 연세대 교수는 “미국은 경기가 좋지만, 우리나라 상황이 워낙 안 좋다”며 “이창용 한은 총재도 2월 인하를 사실상 말했고, 지금 내수가 너무 침체하니 일단은 인하하지 않을까 싶다”고 전망했다. 그러나 “미국이 금리 인하 속도를 조절하면서 이에 맞춰야 할 필요가 있다”며 “미국은 하반기에 오히려 금리를 높일 가능성이 있다는 얘기까지 나온다”고 강조했다. 이어 “우리나라가 금리를 많이 내리기 어렵고, 저성장의 고통을 국민들이 상당히 겪게 될 것”이라고 덧붙였다."
